rank,uri,artist_names,track_name,source,peak_rank,previous_rank,days_on_chart,streams,lastfm_tags,album,release_date,days_since_release
23,spotify:track:1BxfuPKGuaTgP7aM0Bbdwr,Taylor Swift,Cruel Summer,Taylor Swift,2,24,561,2805741,electropop; pop; synthpop; industrial pop; synthwave,Lover,,
42,spotify:track:2OzhQlSqBEmt7hmkYxfT6m,"Taylor Swift, Post Malone",Fortnight (feat. Post Malone),Taylor Swift,1,46,123,2171515,pop; best of 2024; soty; synthpop; singer-songwriter,The Tortured Poets Department (Webstore Exclusive),,
64,spotify:track:3hUxzQpSfdDqwM3ZTFQY0K,Taylor Swift,august,Taylor Swift,4,72,450,1900074,dream pop; folk; folk pop; indie pop; indie,folklore: the long pond studio sessions (from the Disney+ special),,
98,spotify:track:4q5YezDOIPcoLr8R81x9qy,Taylor Swift,I Can Do It With a Broken Heart,Taylor Swift,3,107,123,1617987,pop; best of 2024; synthpop; dance-pop; soty,THE TORTURED POETS DEPARTMENT,,
156,spotify:track:1dGr1c8CrMLDpV6mPbImSI,Taylor Swift,Lover,Taylor Swift,2,165,501,1367845,pop; country; love; indie folk; country pop,You Belong With Me,,
192,spotify:track:4R2kfaDFhslZEMJqAFNpdd,Taylor Swift,cardigan,Taylor Swift,1,199,509,1242131,folk pop; folk; chamber pop; singer-songwriter; indie,Now That's What I Call Music! Vol. 76,,
