rank,uri,artist_names,track_name,source,peak_rank,previous_rank,days_on_chart,streams,lastfm_tags,album,release_date,days_since_release
21,spotify:track:1BxfuPKGuaTgP7aM0Bbdwr,Taylor Swift,Cruel Summer,Taylor Swift,2,20,527,3139118,electropop; pop; synthpop; industrial pop; synthwave,Lover,,
23,spotify:track:2OzhQlSqBEmt7hmkYxfT6m,"Taylor Swift, Post Malone",Fortnight (feat. Post Malone),Taylor Swift,1,23,89,3069650,pop; best of 2024; soty; synthpop; singer-songwriter,The Tortured Poets Department (Webstore Exclusive),,
25,spotify:track:4q5YezDOIPcoLr8R81x9qy,Taylor Swift,I Can Do It With a Broken Heart,Taylor Swift,3,54,89,2923489,pop; best of 2024; synthpop; dance-pop; soty,THE TORTURED POETS DEPARTMENT,,
171,spotify:track:0W0iAC1VGlB82PI6elxFYf,Taylor Swift,Guilty as Sin?,Taylor Swift,11,187,87,1312504,pop; best of 2024; singer-songwriter; pop rock; soty,THE TORTURED POETS DEPARTMENT,,
190,spotify:track:2F3N9tdombb64aW6VtZOdo,Taylor Swift,Down Bad,Taylor Swift,2,196,87,1267444,pop; synthpop; best of 2024; love at first listen; pop perfect,THE TORTURED POETS DEPARTMENT,,
192,spotify:track:1dGr1c8CrMLDpV6mPbImSI,Taylor Swift,Lover,Taylor Swift,2,200,467,1265379,pop; country; love; indie folk; country pop,You Belong With Me,,
