rank,uri,artist_names,track_name,source,peak_rank,previous_rank,days_on_chart,streams
1,"spotify:track:2Pu2Kcm1cwFg4dDSdmFip4","Niska","Réseaux","Universal Music Division Capitol Music France",1,2,9,"158798"
2,"spotify:track:2UZW9WOPXdxw9YMG1bebS8","Damso","Θ. Macarena","Universal Music Division Carthage Music",1,1,79,"156591"
3,"spotify:track:1OAh8uOEOvTDqkKFsKksCi","DJ Khaled, Rihanna, Bryson Tiller","Wild Thoughts (feat. Rihanna & Bryson Tiller)","Epic/We The Best",1,3,30,"137059"
4,"spotify:track:5CtI0qwDJkDQGwXD1H1cLb","Luis Fonsi, Daddy Yankee, Justin Bieber","Despacito - Remix","UMLE - Latino",2,4,89,"126279"
5,"spotify:track:5bcTCxgc7xVfSaMV3RuVke","Calvin Harris, Pharrell Williams, Katy Perry, Big Sean, Funk Wav","Feels (feat. Pharrell Williams, Katy Perry & Big Sean)","Columbia",4,5,30,"115268"
6,"spotify:track:7qiZfU4dY1lWllzX7mPBI3","Ed Sheeran","Shape of You","Atlantic Records UK",1,6,191,"113514"
7,"spotify:track:3B54sVLJ402zGa6Xm4YGNe","French Montana, Swae Lee","Unforgettable","Bad Boy Entertainment/Epic Records",4,7,90,"106219"
8,"spotify:track:4fwtP5khM1iEoa6BP1QQsX","Lartiste, Awa Imani","Chocolat (feat. Awa Imani)","Purple Money / Zayn Corporation",4,8,160,"102932"
9,"spotify:track:08GhiNwYij4HNVkBZnJvft","Ninho","Mamacita","Rec. 118 / Mal Luné Music",9,10,10,"102442"
10,"spotify:track:4aWmUDTfIPGksMNLV2rQP2","Luis Fonsi, Daddy Yankee","Despacito","UMLE - Latino",2,9,174,"98403"
11,"spotify:track:4iLqG9SeJSnt0cSPICSjxv","Charlie Puth","Attention","Artist Partner",4,11,85,"94967"
12,"spotify:track:6kex4EBAj0WHXDKZMEJaaF","Jason Derulo, Nicki Minaj, Ty Dolla $ign","Swalla (feat. Nicki Minaj & Ty Dolla $ign)","Beluga Heights/Warner Records",6,14,112,"90172"
13,"spotify:track:3DXncPQOG4VBw3QHh3S817","DJ Khaled, Justin Bieber, Quavo, Chance the Rapper, Lil Wayne","I'm the One (feat. Justin Bieber, Quavo, Chance the Rapper & Lil Wayne)","Epic/We The Best",4,15,79,"88965"
14,"spotify:track:49qQQcd8wONsOy3PwnZKHB","Jul","Ma jolie","D'Or et de Platine",5,12,16,"88241"
15,"spotify:track:3A7qX2QjDlPnazUsRk5y0M","David Guetta, Justin Bieber","2U (feat. Justin Bieber)","Parlophone (France)",6,13,37,"87747"
16,"spotify:track:0CcQNd8CINkwQfe1RDtGV6","Imagine Dragons","Believer","Kid Ina Korner / Interscope",11,18,157,"86429"
17,"spotify:track:0NiXXAI876aGImAd6rTj8w","Jonas Blue, William Singe","Mama","UMOD (Universal Music On Demand)",14,16,49,"85910"
18,"spotify:track:3ACvYZqgoP36dURFeovOR8","Booba","Nougat","Universal Music Distribution Deal",1,17,9,"81280"
19,"spotify:track:3rOSwuTsUlJp0Pu0MkN8r8","Future","Mask Off","Epic/Freebandz/A1",2,20,143,"80509"
20,"spotify:track:03aduXwm6cTqO9bb4XFQ2b","Damso","Ε. Signaler","Universal Music Division Carthage Music",5,19,79,"78615"
21,"spotify:track:2jBleFNl3YK8lyJc1OvxXt","PNL","Jusqu'au dernier gramme","QLF Records",14,21,181,"76778"
22,"spotify:track:1NAeorrSNCibpdJMpXLFeG","Ødyssey, Amara Abonta","Fly","Kalyna Music",10,22,57,"75012"
23,"spotify:track:2rb5MvYT7ZIxbKW5hfcHx8","J Balvin, Willy William","Mi Gente","Scorpio Music (FR)",23,23,12,"75010"
24,"spotify:track:7nKBxz47S9SD79N086fuhn","Enrique Iglesias, Descemer Bueno, Zion & Lennox","SUBEME LA RADIO","RCA Records/Sony Music International/Sony Music Latin",11,24,119,"74077"
25,"spotify:track:7tr2za8SQg2CI8EDgrdtNl","Calvin Harris, Frank Ocean, Migos, Funk Wav","Slide (feat. Frank Ocean & Migos)","Columbia",17,25,142,"69476"
26,"spotify:track:1x5sYLZiu9r5E43kMlt9f8","Clean Bandit, Zara Larsson","Symphony (feat. Zara Larsson)","Atlantic Records UK",7,26,116,"69035"
27,"spotify:track:1NDxZ7cFAo481dtYWdrUnR","Maggie Lindemann, Cheat Codes, CADE","Pretty Girl - Cheat Codes X CADE Remix","300 Entertainment",17,28,61,"64321"
28,"spotify:track:2KklXplRtxMsBYo474Es0w","Ofenbach","Be Mine","Elektra France",5,36,185,"62544"
29,"spotify:track:1E3zyoTHtJzsu5CjwIFIhY","Damso","Γ. Mosaïque solitaire","Universal Music Division Carthage Music",3,27,79,"62052"
30,"spotify:track:78rIJddV4X0HkNAInEcYde","Starley, Ryan Riback","Call on Me - Ryan Riback Remix","Central Station Records",2,29,196,"60761"
31,"spotify:track:3cFsmM51N5zMAuu1nNY4Tw","Sean Paul, Dua Lipa","No Lie","Universal-Island Records Ltd.",14,32,154,"60360"
32,"spotify:track:3Ytr1SUCUi6J3L9dRFx5iH","Major Lazer, Travis Scott, Camila Cabello, Quavo","Know No Better (feat. Travis Scott, Camila Cabello & Quavo)","Third Pardee Records",27,31,44,"60279"
33,"spotify:track:6RUKPb4LETWmmr3iAEQktW","The Chainsmokers, Coldplay","Something Just Like This","Disruptor Records/Columbia",6,35,143,"59631"
34,"spotify:track:0tKcYR2II1VCQWT79i5NrW","Imagine Dragons","Thunder","Kid Ina Korner / Interscope",15,30,67,"58678"
35,"spotify:track:3eR23VReFzcdmS7TYCrhCe","Kygo, Selena Gomez","It Ain't Me (with Selena Gomez)","Kygo",2,37,150,"58282"
36,"spotify:track:6jA8HL9i4QGzsj6fjoxp8Y","Martin Garrix, Troye Sivan","There for You","Epic Amsterdam",23,41,51,"57549"
37,"spotify:track:4q8PHoRsPUB52LFylX8Ulz","Axwell /\ Ingrosso, Axwell, Sebastian Ingrosso","More Than You Know","Pophouse Entertainment Group",29,39,28,"56316"
38,"spotify:track:5EnYT6F7wEcdege6mDHEfO","Drake","Signs","Cash Money Records/Young Money Ent./Universal Rec.",32,34,22,"55981"
39,"spotify:track:2Gl0FzuLxflY6nPifJp5Dr","Kygo, Ellie Goulding","First Time","Kygo",23,42,77,"55760"
40,"spotify:track:6y2Kaz9QI01XBKJ8mTb7Pf","Rag'n'Bone Man","Skin","Best Laid Plans/Columbia",28,44,162,"55751"
41,"spotify:track:0gn0krlJTSSZvnMxh2ITHY","Sofiane","Mon p'tit loup","Universal Music Division Capitol Music France",9,33,93,"55706"
42,"spotify:track:4HvYhaXDmmAW6ZmPcgPZca","Damso","B. #QuedusaalVie","Universal Music Division Carthage Music",2,40,79,"55250"
43,"spotify:track:79cuOz3SPQTuFrp8WgftAu","Shawn Mendes","There's Nothing Holdin' Me Back","Island Records",22,38,86,"54773"
44,"spotify:track:00lNx0OcTJrS3MKHcB80HY","Jax Jones, RAYE","You Don't Know Me (feat. RAYE)","Polydor Records",3,43,150,"54256"
45,"spotify:track:0afhq8XCExXpqazXczTSve","Ed Sheeran","Galway Girl","Atlantic Records UK",8,45,135,"54171"
46,"spotify:track:0dA2Mk56wEzDgegdC6R17g","Zedd, Alessia Cara","Stay","UMGRI Interscope",15,46,140,"51760"
47,"spotify:track:57U26FwUclMqyZ5ylnPpw1","Damso","Α. Nwaar Is The New Black","Universal Music Division Carthage Music",1,48,81,"51137"
48,"spotify:track:2fgk04HR0nlgNysfX7fKF0","Lorenzo","Fume à fond","MFC",13,51,30,"50332"
49,"spotify:track:3bWAqKDWg6u1davspr5IkS","Robin Schulz, James Blunt","OK","WM Germany",29,52,34,"50032"
50,"spotify:track:75UFzgBCaVwJJ4IVIaatpe","Damso","N. J Respect R","Universal Music Division Carthage Music",7,49,79,"49417"
51,"spotify:track:6EpRaXYhGOB3fj4V2uDkMJ","Liam Payne, Quavo","Strip That Down (feat. Quavo)","Capitol Records UK / EMI",31,50,55,"48511"
52,"spotify:track:3VdDQkNCQKPAL4nZlFKWlN","Benash, Booba","Ghetto","Universal Music Division Capitol Music France",9,53,135,"46430"
53,"spotify:track:00X2yv2vrtritPt2CZnUTZ","PNL","Bené","QLF Records",3,55,196,"45700"
54,"spotify:track:1sXUWdKx03aP9Gmzft58rt","Julia Michaels","Issues","J/Republic",21,54,154,"45573"
55,"spotify:track:6Y6mUgZmUadVvfFuoGuy64","Niska","Chasse à l'homme","Universal Music Division Capitol Music France",51,58,79,"44129"
56,"spotify:track:3ebXMykcMXOcLeJ9xZ17XH","Martin Garrix, Dua Lipa","Scared to Be Lonely","Epic Amsterdam",7,57,170,"43939"
57,"spotify:track:4GCIYE1x1TWJCChPkpy9by","PNL","Onizuka","QLF Records",10,56,196,"43725"
58,"spotify:track:0z18wqbjuXTxzaNm4oegU2","Lacrim, Booba","Oh bah oui","Universal Music Division Capitol Music France",1,59,107,"43146"
59,"spotify:track:00cbRAOr6wTPE9WBMejhiM","Mister V, Hayce Lemsi, Volts Face","Space Jam","Hey Pelo Records",2,60,58,"42616"
60,"spotify:track:0XLOf9LhyazPX9Ld8jPiUq","Selena Gomez, Gucci Mane","Fetish (feat. Gucci Mane)","Selena Gomez PS",47,47,3,"41740"
61,"spotify:track:4c2W3VKsOFoIg2SFaO6DY5","Rita Ora","Your Song","Atlantic Records UK",52,65,44,"41513"
62,"spotify:track:7KXjTSCq5nL1LoYtL7XAwS","Kendrick Lamar","HUMBLE.","Aftermath",3,61,107,"40801"
63,"spotify:track:61WbtB6ujkpNAsAf5LjF4b","Katy Perry, Migos","Bon Appétit","Capitol Records (CAP)",27,66,68,"40712"
64,"spotify:track:7B9TO9Syt0JoFJIQAqtTYJ","RIDSA","Avancer","Wagram Music / W Lab",53,69,25,"40443"
65,"spotify:track:6QfPyKRfSQBb3ccajHioEm","L'Algérino","Les menottes (Tching Tchang Tchong)","Black Pearl Music",64,64,45,"40197"
66,"spotify:track:0U050yYuyc2Gq9hrfvfEq8","Hornet La Frappe","Gramme 2 peuf","Rec. 118 / Diez Peufra",28,63,148,"40135"
67,"spotify:track:3vRKEsv161Ekp1ASrIh70L","MHD","Bravo","Universal Music Division Capitol Music France",35,68,30,"39867"
68,"spotify:track:376JSYpMMIJteMBozHUix0","Jul","Je ne me vois pas briller","D'Or et de Platine",29,67,60,"39308"
69,"spotify:track:03i0AsAY16ND5XlawvTOAu","MHD","Afro Trap Pt. 9 (Faut les wet)","Universal Music Division Capitol Music France",62,62,2,"38758"
70,"spotify:track:5axLlrd4jZZs0eAKIeNtOX","Sadek, Niska","En leuleu (feat. Niska)","Rec. 118 / Industreet",70,71,10,"38306"
71,"spotify:track:5xhJmd0I15jFcEdqxfCzKk","The Chainsmokers, Louane","It Won't Kill Ya","Disruptor Records/Columbia",24,73,100,"38063"
72,"spotify:track:6xcXAVbDuVT1pCsa2rmDHY","Siboy, Benash, Damso","Mobali","Universal Music Division Capitol Music France",57,70,16,"36687"
73,"spotify:track:1ssmjAYSU5PbmsjLq5yrNH","Sia","Never Give Up (From ""Lion"" Soundtrack)","Masterworks",22,76,127,"36260"
74,"spotify:track:29rRQITL0TE9bcoi66i2O5","Lacrim, GIMS","Ce soir ne sors pas","Universal Music Division Capitol Music France",58,74,9,"35283"
75,"spotify:track:5GXAXm5YOmYT0kL5jHvYBt","The Weeknd, Daft Punk","I Feel It Coming","The Weeknd/Lyric",6,83,196,"35179"
76,"spotify:track:2QXNsj3HmqbDqbw0R9F5zo","Sofiane","Toka","Universal Music Division Capitol Music France",14,72,93,"35163"
77,"spotify:track:5lvYLKGuBWNTpk505KUr1E","Alonzo","Bagarre","Universal Music Division Island Def Jam",76,78,16,"35141"
78,"spotify:track:3VvXGTB7qzTJ0nBOBwiH9X","Sadek","Dans la lune","Rec. 118 / Industreet",75,81,58,"34698"
79,"spotify:track:4ysXJQqi5zH0yz1R4sna52","Niska","B.O.C","Universal Music Division Capitol Music France",33,82,128,"34311"
80,"spotify:track:4rrzxq356QDANDVd0SB1Dq","Mister V","Top album","Hey Pelo Records",3,79,78,"34242"
81,"spotify:track:4JIOC5P1G1NjhRJ2JSXm41","Dabs","Ouloulou","Colored Music",56,80,170,"34180"
82,"spotify:track:7BCZh8tgdw8HuUsvqlNBDR","Bigflo & Oli","Alors alors","Universal Music Division Virgin Records",51,75,29,"34001"
83,"spotify:track:2eMwDehkIC1j68U6FA3Eiq","Lil Uzi Vert","XO Tour Llif3","Generation Now/Atlantic",71,77,81,"33675"
84,"spotify:track:5FRCTmIl1SIie075FoVsqA","Kalash Criminel, Jul","Je ne comprends pas","Universal Music Division Capitol Music France",48,86,58,"33402"
85,"spotify:track:1YcY5Iiv3Ab68QC2rMKuBP","Niska","J'suis dans l'baye","Universal Music Division Capitol Music France",75,90,100,"32968"
86,"spotify:track:0lkQfsTMmtDA37tjjew9n0","PNL","Naha","QLF Records",22,84,196,"32856"
87,"spotify:track:5ZXmCqIzh9cRaMMfdtHuyZ","Andrelli","Old Man","Firefly Entertainment",71,93,31,"32845"
88,"spotify:track:0FuTx2s3YH1ppmtiM6l0zI","JP Cooper","September Song","Universal-Island Records Ltd.",50,92,156,"32759"
89,"spotify:track:5zCO1EU3KpM2tsFaZdu9vq","Kaaris","Boyz N The Hood","Universal Music Division Virgin Records",83,89,134,"32668"
90,"spotify:track:5urhEtesorARjZhjSaFntn","Damso","Ζ. Kietu","Universal Music Division Carthage Music",6,85,79,"32260"
91,"spotify:track:0hNduWmlWmEmuwEFcYvRu1","Petit Biscuit","Sunset Lover","Petit Biscuit",2,87,196,"32217"
92,"spotify:track:6nGSXuZrE5P7gSvtJs4unC","Damso","Κ. Kin la belle","Universal Music Division Carthage Music",12,88,79,"31961"
93,"spotify:track:3SD7hc30MJdcSadQgHUBWl","JADED","In the Morning","Black Butter",79,96,8,"31792"
94,"spotify:track:1xznGGDReH1oQq0xzbwXa3","Drake, Wizkid, Kyla","One Dance","Cash Money Records/Young Money Ent./Universal Rec.",1,91,196,"31121"
95,"spotify:track:1i03F8e3iYugaWN1r1QCbU","Niro","Sors de ma tête","Universal Music Division Capitol Music France",79,94,9,"30425"
96,"spotify:track:337NxxJAxClIStxYcu7HNG","Naps, 13ème Art, Graya, Kalif, Raisse, YL, Dika","Pochon bleu","Duetti",76,98,70,"29902"
97,"spotify:track:7syABtsvHvD3nO7OG91Ani","Sofiane","Tout l'monde s'en fout","Suther Kane",3,95,170,"29793"
98,"spotify:track:36giaa7roszmJh3okF5efv","Jul","C'est pas ma faute","D'Or et de Platine",46,97,16,"29327"
99,"spotify:track:0lMbuWUpfTWhEmOKxppEau","Calvin Harris, Future, Khalid, Funk Wav","Rollin (feat. Future & Khalid)","Columbia",44,100,61,"28945"
100,"spotify:track:6ATkHaUrIJUtwyhoGMmQgw","Damso","Δ. Dieu ne ment jamais","Universal Music Division Carthage Music",6,99,79,"28742"
101,"spotify:track:0UXW6ihyeYHfb4jae7QxGl","DTF","100 rêves","QLF Records",57,104,69,"28424"
102,"spotify:track:1Eck97uRMlprKOOJN9oO1E","G-Eazy, Kehlani","Good Life (with G-Eazy & Kehlani)","Artist Partner",46,106,96,"28316"
103,"spotify:track:6HViP4DVYa8gQtxLndmhwu","Møme, Merryn Jeann","Aloha","Universal Music Division Virgin Records",20,121,196,"28291"
104,"spotify:track:5UOGzIMvxXyRZIWBbqDcpU","PNL","DA","QLF Records",58,103,196,"27841"
105,"spotify:track:1oXiNxPogfnfVMiqGdr2Pv","Jul, Kalash Criminel","Cagoulé","D'Or et de Platine",44,102,16,"27732"
106,"spotify:track:4Hg1iEa7zg4Z0l2oxpARIL","Naps","Ciao","Duetti",92,105,57,"27235"
107,"spotify:track:4qknM1pQz53QOyfDVTjcM9","Shakira","Me Enamoré","Sony Music Latin",105,113,23,"27088"
108,"spotify:track:5Ik150YpJw117EFg5gF9lP","Naps","À part ça","Duetti",69,109,60,"26907"
109,"spotify:track:4J6xvZhJh26lmAEAXGDCKu","Naive New Beaters, Izïa","Heal Tomorrow","Universal Music Division Capitol Music France",28,156,180,"26823"
110,"spotify:track:2KkD7TsSOHyG8sXdhLkTf8","SCH","MAC 11","Universal Music Division Capitol Music France",16,112,49,"26764"
111,"spotify:track:63z6p4gpgnpZprANkpBIHH","Dosseh, Booba","Infréquentables","Universal Music Division Capitol Music France",18,107,196,"25670"
112,"spotify:track:1MUxJxub6ovS0rzTHRgyoF","MHD","Afro Trap Pt. 8 (Never)","Universal Music Division Capitol Music France",2,114,142,"25595"
113,"spotify:track:4myoVer3cPAUqBzDigYf7A","Damso","Λ. Lové","Universal Music Division Carthage Music",11,108,79,"25554"
114,"spotify:track:2Z8WuEywRWYTKe1NybPQEW","Twenty One Pilots","Ride","Fueled By Ramen",19,159,183,"25547"
115,"spotify:track:450XNJRan5KMcpueK59gGo","BMYE, Naza, KeBlack, Youssoupha, Hiro, Jaymax, DJ Myst","Pourquoi chérie","Bomaye musik",115,117,18,"25310"
116,"spotify:track:2bqexboOK1opJI8vjq3ISh","Jul","Beely","D'Or et de Platine",51,110,31,"25116"
117,"spotify:track:5YIbA6i8pPUnl6CDpVDa63","Dadju","Reine","Universal Music Division Capitol Music France",98,118,70,"25107"
118,"spotify:track:6x8j5V85ZJHtvOSjSamcVc","MHD","Afro Trap Pt. 7 (La puissance)","Universal Music Division Capitol Music France",3,122,196,"24738"
119,"spotify:track:5NZpY9WeWFtlHVgepfCamX","PNL","Dans la légende","QLF Records",45,119,194,"24505"
120,"spotify:track:45KqDHTOJtIM53QR1gPGTa","Rilès","Brothers","RILÈSUNDAYZ",38,120,83,"24351"
121,"spotify:track:6520aj0B4FSKGVuKNsOCOi","Katy Perry, Skip Marley","Chained To The Rhythm","Capitol Records (CAP)",15,116,156,"24188"
122,"spotify:track:7gXWIxX7rUtKGNtRkot8p3","RIDSA","Mamamia","Wagram Music / W Lab",122,128,45,"24101"
123,"spotify:track:2hMBPbAkEC0wu6iylhdiaJ","DJ Sem, Marwa Loud","Mi Corazón","Universal Music Division Island Def Jam",123,141,3,"23691"
124,"spotify:track:33dLYyEIRqEipCuLb8z1l0","Lacrim","La dolce vita","Universal Music Division Capitol Music France",6,124,107,"23680"
125,"spotify:track:7dJqvusDNhwkkxb9UgKREN","Aya Nakamura","Comportement","Rec. 118",124,126,33,"23674"
126,"spotify:track:0qYTZCo5Bwh1nsUFGZP3zn","Maluma","Felices los 4","Sony Music Latin",126,135,48,"23634"
127,"spotify:track:27SdWb2rFzO6GWiYDBTD9j","Sia","Cheap Thrills","Monkey Puzzle Records/RCA Records",27,179,184,"23469"
128,"spotify:track:5knuzwU65gJK7IF5yJsuaW","Clean Bandit, Anne-Marie, Sean Paul","Rockabye (feat. Sean Paul & Anne-Marie)","Atlantic Records UK",2,125,196,"23282"
129,"spotify:track:1sCxVKWImDZSZKvG0U9B23","Selena Gomez","Bad Liar","Selena Gomez PS",51,123,59,"23261"
130,"spotify:track:0KKkJNfGyhkQ5aFogxQAPU","Bruno Mars","That's What I Like","Atlantic Records",31,136,140,"23260"
131,"spotify:track:6mICuAdrwEjh6Y6lroV2Kg","Shakira, Maluma","Chantaje (feat. Maluma)","Sony Music Latin",13,142,195,"22821"
132,"spotify:track:7hDc8b7IXETo14hHIHdnhd","Drake","Passionfruit","Cash Money Records/Young Money Ent./Universal Rec.",2,145,119,"22617"
133,"spotify:track:71gEIIqahWVslRCXtN5yhK","Djadja & Dinaz","Déstabilisé","Carré-Music",12,130,153,"22489"
134,"spotify:track:28co1mTCrGIGOeGzqLjSat","Lacrim","Grande armée","Universal Music Division Capitol Music France",2,133,149,"22426"
135,"spotify:track:3kxfsdsCpFgN412fpnW85Y","Childish Gambino","Redbone","Glassnote - VMG",135,144,39,"22348"
136,"spotify:track:2Vd1vVQaBilW0O6nmU5BkH","Vianney","Je m'en vais","Tôt Ou Tard",2,127,196,"22272"
137,"spotify:track:0NUvPSk4VzBW0ClqgGxNRj","Vald, Damso","Vitrine","Universal Music Division Capitol Music France",29,147,167,"22178"
138,"spotify:track:7A3rNO7cmVKM3boOmIBwtj","S.Pri Noir","Highlander","Believe Recordings",115,150,28,"22120"
139,"spotify:track:58zsLZPvfflaiIbNWoA22O","Rag'n'Bone Man","Human","Best Laid Plans/Columbia",5,131,196,"21954"
140,"spotify:track:5t9fmZx0pcNxLykKTv6eOe","Nekfeu, Sneazzy, S.Pri Noir","Saturne","Universal Music Division Carthage Music",5,139,196,"21893"
141,"spotify:track:1iDQ2zCOU1uYeR8QcpqUZb","Booba","DKR - Bonus Track","Universal Music Distribution Deal",14,138,192,"21861"
142,"spotify:track:6QgjcU0zLnzq5OrUoSZ3OK","Portugal. The Man","Feel It Still","Atlantic Records",142,-1,4,"21844"
143,"spotify:track:6HUnnBwYZqcED1eQztxMBN","Martin Jensen","Solo Dance","Intercord",109,132,154,"21835"
144,"spotify:track:0tICYNayWWhH9GPeFrfjfD","Kungs, Cookin' On 3 Burners","This Girl (Kungs Vs. Cookin' On 3 Burners)","Universal Music Division Polydor France",80,143,178,"21807"
145,"spotify:track:6gLkunWShYxvE8p7AGXbw3","Jul","Je suis resté le même","D'Or et de Platine",45,134,16,"21762"
146,"spotify:track:4pdPtRcBmOSQDlJ3Fk945m","DJ Snake, Justin Bieber","Let Me Love You","DJ Snake Def Jam",7,140,196,"21713"
147,"spotify:track:5nQHYFZC2mcUF1ouFBPsz1","Scridge","Pour walou","Snafu Records",121,155,81,"21656"
148,"spotify:track:6JMdhGfyz9C4kA4mTc6y9C","SCH","Comme si","Universal Music Division Capitol Music France",4,149,100,"21351"
149,"spotify:track:6De0lHrwBfPfrhorm9q1Xl","Danny Ocean","Me Rehúso","Atlantic Records",120,154,40,"21189"
150,"spotify:track:4kKJ5CjwCtksszPMntho4N","Nekfeu","Mauvaise graine","Universal Music Division Carthage Music",1,151,196,"21085"
151,"spotify:track:3HVr6jTVwBHBa2flM0eURR","Macklemore, Skylar Grey","Glorious (feat. Skylar Grey)","Bendo LLC",113,115,9,"21015"
152,"spotify:track:1OYlOIc7UdRBe1daHclsRU","Bigflo & Oli","Personne","Universal Music Division Virgin Records",59,-1,26,"21000"
153,"spotify:track:33N0DD1cmllJxjKQvJkFo2","Dosseh","PDCV (Pas dans cette vie)","Universal Music Division Capitol Music France",153,-1,1,"20852"
154,"spotify:track:6D8tdYo3mBOIUrWAk8wOVo","Alonzo, MHD","Feu d'artifice","Universal Music Division Island Def Jam",44,157,121,"20844"
155,"spotify:track:7FXXVMGfMLy1IkmgDIZJBp","Deen Burbigo, Nekfeu","Tu rêves","Universal Music Division Virgin Records",55,148,42,"20768"
156,"spotify:track:3akaKS6VFRCuMx0Ixfv3MZ","Jul","Monde violent","D'Or et de Platine",63,153,16,"20714"
157,"spotify:track:0fBxgiQe76HZFFqN2FUUpw","Damso","Η. Gova","Universal Music Division Carthage Music",9,152,79,"20712"
158,"spotify:track:1kgws2l8gsvDhtsVyzWbu9","Parcels","Overnight","Because Music",103,129,20,"20690"
159,"spotify:track:6i50VdSdYcpnkuwTV2XhfW","Niro","Avant de partir","Universal Music Division Capitol Music France",106,146,8,"20498"
160,"spotify:track:6ymKsfbFtQ12mmPJxPAamb","SCH","Poupée russe","Universal Music Division Capitol Music France",14,173,86,"20403"
161,"spotify:track:2sOrroHqKbYFP2MfHxhQMc","Rim'K","Cellophané","MB",51,162,196,"20398"
162,"spotify:track:17Fd6Yb7mSbinKG8LoWfFl","Mike Posner, Seeb","I Took A Pill In Ibiza - Seeb Remix","Monster Mountain, LLC / Island",18,169,193,"20396"
163,"spotify:track:6QUDs5wTqWwI4Ed68GLdlC","Ninho","Roro","Rec. 118 / Mal Luné Music",67,167,84,"20361"
164,"spotify:track:3WR4pU96KUOlAOTgYCefdH","Bengous","Tié la famille !","Universal Music Division Capitol Music France",111,111,2,"20320"
165,"spotify:track:5B13mNIiknPY2zKCyn1O6L","S.Pri Noir","Skywalker","Believe Recordings",124,166,89,"20212"
166,"spotify:track:6iTVIAqZpHmCK9jrpDyDVo","Kungs, Ephemerals","I Feel So Bad","Universal Music Division Polydor France",23,172,184,"20180"
167,"spotify:track:2lFWyfuXtCN8Sb7cHJILva","PNL","J'suis QLF","QLF Records",93,161,112,"20174"
168,"spotify:track:3fHXUNVKNZQ4WaUGLwWxHP","Damso, Booba","Paris c'est loin","Universal Music Division Carthage Music",67,164,196,"20168"
169,"spotify:track:6dbdxneD4mLKDgXJ6GQkJm","Soprano","Roule","Rec. 118",54,163,141,"20162"
170,"spotify:track:0nhKXS1KL8ffn40Un1q91D","Sofiane","Poto","Universal Music Division Capitol Music France",35,170,64,"20097"
171,"spotify:track:5ZtoiFGlZ3tur8NJAMn0ws","Rilès","THANK GOD","Republic Records",53,165,82,"19983"
172,"spotify:track:2GP3ncrLU8jeyrnLTi9uZ1","Keen' V","Elle a","Warner (France)",122,158,9,"19968"
173,"spotify:track:0ban5QRXUveaKtQPGuaoQ9","Kaaris","Tchoin","Universal Music Division Virgin Records",2,171,193,"19885"
174,"spotify:track:1uaAq8pSghvpVxlrOrgdeO","Lomepal","Yeux disent","Pineale Prod - Grand Musique Management",115,188,22,"19509"
175,"spotify:track:3AbR9rS5iPPPG5F5TJtLMs","Sadek, Brulux","La Bise (feat. Brulux)","Rec. 118 / Industreet",59,177,191,"19490"
176,"spotify:track:3a1lNhkSLSkpJE4MSHpDu9","Post Malone, Quavo","Congratulations","Mercury Records/Republic Owned",145,168,35,"19405"
177,"spotify:track:0L7loeTIg6akW84aEQZpCT","Major Lazer, Nyla, Fuse ODG","Light It Up","Third Pardee Records",45,176,167,"19394"
178,"spotify:track:4I2Z1gxRN4f55EmMwhzKxK","Benash, Shay, Damso","Ivre","Universal Music Division Capitol Music France",88,183,69,"19351"
179,"spotify:track:1A5yplwEk6cJbAL63L6bkp","Deorro, Pitbull, Elvis Crespo","Bailar","Scorpio Music",73,-1,57,"19316"
180,"spotify:track:65mBlk8cyhVpe1OUhLShhp","Naps","Vroum vroum","Duetti",126,181,52,"19314"
181,"spotify:track:1wxBP4KwMN2UyMJc6S0GJn","Naza","A Gogo","Bomaye musik",181,191,3,"19313"
182,"spotify:track:5vZW3QAWw2PY5323r7yI0Z","Jul","Saoûlé","D'Or et de Platine",41,160,16,"19206"
183,"spotify:track:2091VoRuYGLceKmindxKbH","Jul","Le 46 de Rossi","D'Or et de Platine",44,174,16,"19108"
184,"spotify:track:36jQqAX9GW4QbS6jvlvjC1","Jul","Flêcheur fou","D'Or et de Platine",92,182,16,"18970"
185,"spotify:track:6wR97bho2QoIiP5wxNxtQz","Djadja & Dinaz","C'est la même","Carré-Music",25,187,125,"18853"
186,"spotify:track:6O85MfGECKBqAK2MgSbCaj","Martin Solveig, Ina Wroldsen","Places","EMI",35,192,131,"18707"
187,"spotify:track:2hgzdQdnfWwtdpZbhZlV72","Jennifer Lopez","Ain't Your Mama","Epic/Nuyorican Productions",33,-1,117,"18696"
188,"spotify:track:4WjH9Bzt3kx7z8kl0awxh4","Major Lazer, MØ, DJ Snake","Lean On (feat. MØ & DJ Snake)","Third Pardee Records",66,-1,125,"18689"
189,"spotify:track:2XOXx2U5IIoBRPlmGgDqj8","Polo & Pan","Canopée","Universal Music Division Virgin Records Distribution Deal",188,-1,2,"18635"
190,"spotify:track:3aLSrx8qhssXrh5yjB6oy9","Martin Solveig, ALMA","All Stars","EMI",151,189,9,"18633"
191,"spotify:track:64I0PKLFEKlcvc7fEVUGq0","Izzy Bizu","White Tiger - Single Version","Epic",86,-1,65,"18434"
192,"spotify:track:6tM2eT1MabbdZUFtiEBdjb","Lorenzo","Freestyle du sale","MFC",163,-1,6,"18329"
193,"spotify:track:1Ylz8QTIwBUbO20z8VJyop","Naza","MMM","Bomaye musik",193,-1,1,"18274"
194,"spotify:track:2HzJCYwtTXqrj72mE2hnEW","Jul, Norey Fz","Mon tiek ti amo","D'Or et de Platine",81,186,16,"18272"
195,"spotify:track:3NdDpSvN911VPGivFlV5d0","ZAYN, Taylor Swift","I Don’t Wanna Live Forever (Fifty Shades Darker)","Taylor Swift",2,180,194,"18243"
196,"spotify:track:0fg8CqpjdojMyXLNzM2PaJ","Major Lazer, PARTYNEXTDOOR, Nicki Minaj","Run Up","Third Pardee Records",12,194,164,"18225"
197,"spotify:track:5dyDkXi1bnQKSyIdO0JXp8","YALL, Gabriela Richardson","Hundred Miles","Mushroom Pillow",49,-1,15,"18155"
198,"spotify:track:4S1ZmpEshXG3S0OLdodb1W","Sneazzy, Nekfeu","Skurt Cobain","Believe Recordings",86,198,185,"18153"
199,"spotify:track:25C5CowdsfXld2jJanbiex","Demi Lovato","Sorry Not Sorry","Island Records",137,137,2,"18138"
200,"spotify:track:0u6HzAVFUBiKslzPF9G9vd","Ninho","Dis-moi que tu m'aimes","Rec. 118 / Mal Luné Music",66,199,177,"18033"
