rank,uri,artist_names,track_name,source,peak_rank,previous_rank,days_on_chart,streams
1,"spotify:track:2Pu2Kcm1cwFg4dDSdmFip4","Niska","Réseaux","Universal Music Division Capitol Music France",1,1,30,"227465"
2,"spotify:track:08GhiNwYij4HNVkBZnJvft","Ninho","Mamacita","Rec. 118 / Mal Luné Music",2,3,31,"144205"
3,"spotify:track:2UZW9WOPXdxw9YMG1bebS8","Damso","Θ. Macarena","Universal Music Division Carthage Music",1,2,100,"138442"
4,"spotify:track:5bcTCxgc7xVfSaMV3RuVke","Calvin Harris, Pharrell Williams, Katy Perry, Big Sean, Funk Wav","Feels (feat. Pharrell Williams, Katy Perry & Big Sean)","Columbia",4,4,51,"123467"
5,"spotify:track:3B54sVLJ402zGa6Xm4YGNe","French Montana, Swae Lee","Unforgettable","Bad Boy Entertainment/Epic Records",4,5,111,"113993"
6,"spotify:track:7qiZfU4dY1lWllzX7mPBI3","Ed Sheeran","Shape of You","Atlantic Records UK",1,8,212,"111353"
7,"spotify:track:2rb5MvYT7ZIxbKW5hfcHx8","J Balvin, Willy William","Mi Gente","Scorpio Music (FR)",7,7,33,"110495"
8,"spotify:track:1OAh8uOEOvTDqkKFsKksCi","DJ Khaled, Rihanna, Bryson Tiller","Wild Thoughts (feat. Rihanna & Bryson Tiller)","Epic/We The Best",1,6,51,"109600"
9,"spotify:track:5CtI0qwDJkDQGwXD1H1cLb","Luis Fonsi, Daddy Yankee, Justin Bieber","Despacito - Remix","UMLE - Latino",2,9,110,"94979"
10,"spotify:track:0CcQNd8CINkwQfe1RDtGV6","Imagine Dragons","Believer","Kid Ina Korner / Interscope",10,10,178,"90841"
11,"spotify:track:3DXncPQOG4VBw3QHh3S817","DJ Khaled, Justin Bieber, Quavo, Chance the Rapper, Lil Wayne","I'm the One (feat. Justin Bieber, Quavo, Chance the Rapper & Lil Wayne)","Epic/We The Best",4,13,100,"87359"
12,"spotify:track:3A7qX2QjDlPnazUsRk5y0M","David Guetta, Justin Bieber","2U (feat. Justin Bieber)","Parlophone (France)",6,11,58,"86668"
13,"spotify:track:0NiXXAI876aGImAd6rTj8w","Jonas Blue, William Singe","Mama","UMOD (Universal Music On Demand)",10,12,70,"86023"
14,"spotify:track:4fwtP5khM1iEoa6BP1QQsX","Lartiste, Awa Imani","Chocolat (feat. Awa Imani)","Purple Money / Zayn Corporation",4,14,181,"85616"
15,"spotify:track:3HVr6jTVwBHBa2flM0eURR","Macklemore, Skylar Grey","Glorious (feat. Skylar Grey)","Bendo LLC",14,15,30,"81285"
16,"spotify:track:4aWmUDTfIPGksMNLV2rQP2","Luis Fonsi, Daddy Yankee","Despacito","UMLE - Latino",2,16,195,"80282"
17,"spotify:track:4iLqG9SeJSnt0cSPICSjxv","Charlie Puth","Attention","Artist Partner",4,17,106,"77009"
18,"spotify:track:3PEgB3fkiojxms35ntsTgs","Axwell /\ Ingrosso, Axwell, Sebastian Ingrosso","More Than You Know","Pophouse Entertainment Group",13,19,49,"75144"
19,"spotify:track:6xcXAVbDuVT1pCsa2rmDHY","Siboy, Benash, Damso","Mobali","Universal Music Division Capitol Music France",19,20,37,"74916"
20,"spotify:track:03aduXwm6cTqO9bb4XFQ2b","Damso","Ε. Signaler","Universal Music Division Carthage Music",5,18,100,"71422"
21,"spotify:track:3aLSrx8qhssXrh5yjB6oy9","Martin Solveig, ALMA","All Stars","EMI",21,27,26,"71148"
22,"spotify:track:6kex4EBAj0WHXDKZMEJaaF","Jason Derulo, Nicki Minaj, Ty Dolla $ign","Swalla (feat. Nicki Minaj & Ty Dolla $ign)","Beluga Heights/Warner Records",6,22,133,"70814"
23,"spotify:track:2fgk04HR0nlgNysfX7fKF0","Lorenzo","Fume à fond","MFC",13,24,51,"69336"
24,"spotify:track:2jBleFNl3YK8lyJc1OvxXt","PNL","Jusqu'au dernier gramme","QLF Records",14,21,202,"68916"
25,"spotify:track:1x5sYLZiu9r5E43kMlt9f8","Clean Bandit, Zara Larsson","Symphony (feat. Zara Larsson)","Atlantic Records UK",7,25,137,"68847"
26,"spotify:track:49qQQcd8wONsOy3PwnZKHB","Jul","Ma jolie","D'Or et de Platine",5,23,37,"68010"
27,"spotify:track:7nKBxz47S9SD79N086fuhn","Enrique Iglesias, Descemer Bueno, Zion & Lennox","SUBEME LA RADIO","RCA Records/Sony Music International/Sony Music Latin",11,31,140,"67126"
28,"spotify:track:1NDxZ7cFAo481dtYWdrUnR","Maggie Lindemann, Cheat Codes, CADE","Pretty Girl - Cheat Codes X CADE Remix","300 Entertainment",17,29,82,"66777"
29,"spotify:track:1NAeorrSNCibpdJMpXLFeG","Ødyssey, Amara Abonta","Fly","Kalyna Music",10,30,78,"65708"
30,"spotify:track:3Ytr1SUCUi6J3L9dRFx5iH","Major Lazer, Travis Scott, Camila Cabello, Quavo","Know No Better (feat. Travis Scott, Camila Cabello & Quavo)","Third Pardee Records",24,28,65,"64498"
31,"spotify:track:0tKcYR2II1VCQWT79i5NrW","Imagine Dragons","Thunder","Kid Ina Korner / Interscope",15,32,88,"61486"
32,"spotify:track:0xG0SHshCStMEyNbNC5d4k","Julia Michaels","Issues","J/Republic",16,33,175,"61479"
33,"spotify:track:3bWAqKDWg6u1davspr5IkS","Robin Schulz, James Blunt","OK","WM Germany",29,36,55,"60658"
34,"spotify:track:0rDp24SRrDTsrVoUdSWZa2","Columbine, Lujipeka, Chaps","Pierre, feuille, papier, ciseaux","Universal Music Distribution Deal",26,26,2,"59429"
35,"spotify:track:0dA2Mk56wEzDgegdC6R17g","Zedd, Alessia Cara","Stay","UMGRI Interscope",15,34,161,"58500"
36,"spotify:track:2Gl0FzuLxflY6nPifJp5Dr","Kygo, Ellie Goulding","First Time","Kygo",23,40,98,"56717"
37,"spotify:track:7tr2za8SQg2CI8EDgrdtNl","Calvin Harris, Frank Ocean, Migos, Funk Wav","Slide (feat. Frank Ocean & Migos)","Columbia",17,38,163,"56716"
38,"spotify:track:7dJqvusDNhwkkxb9UgKREN","Aya Nakamura","Comportement","Rec. 118",38,39,54,"56510"
39,"spotify:track:3ACvYZqgoP36dURFeovOR8","Booba","Nougat","Universal Music Distribution Deal",1,37,30,"55550"
40,"spotify:track:1E3zyoTHtJzsu5CjwIFIhY","Damso","Γ. Mosaïque solitaire","Universal Music Division Carthage Music",3,35,100,"55508"
41,"spotify:track:6jA8HL9i4QGzsj6fjoxp8Y","Martin Garrix, Troye Sivan","There for You","Epic Amsterdam",23,43,72,"54282"
42,"spotify:track:3eR23VReFzcdmS7TYCrhCe","Kygo, Selena Gomez","It Ain't Me (with Selena Gomez)","Kygo",2,46,171,"52897"
43,"spotify:track:6jTEKtJvIoECSQMEZoLmjR","Hornet La Frappe","Je pense à toi","Rec. 118 / Diez Peufra",43,49,16,"52274"
44,"spotify:track:3rOSwuTsUlJp0Pu0MkN8r8","Future","Mask Off","Epic/Freebandz/A1",2,42,164,"51873"
45,"spotify:track:0r4qxmoxISSJzz3X7WcBRS","Alonzo","Suis-moi","Universal Music Division Island Def Jam",35,41,9,"51492"
46,"spotify:track:79cuOz3SPQTuFrp8WgftAu","Shawn Mendes","There's Nothing Holdin' Me Back","Island Records",22,45,107,"51075"
47,"spotify:track:5EnYT6F7wEcdege6mDHEfO","Drake","Signs","Cash Money Records/Young Money Ent./Universal Rec.",32,47,43,"50813"
48,"spotify:track:6Y6mUgZmUadVvfFuoGuy64","Niska","Chasse à l'homme","Universal Music Division Capitol Music France",35,44,100,"50484"
49,"spotify:track:25C5CowdsfXld2jJanbiex","Demi Lovato","Sorry Not Sorry","Island Records",49,50,23,"50379"
50,"spotify:track:0XLOf9LhyazPX9Ld8jPiUq","Selena Gomez, Gucci Mane","Fetish (feat. Gucci Mane)","Selena Gomez PS",24,48,24,"47982"
51,"spotify:track:4qknM1pQz53QOyfDVTjcM9","Shakira","Me Enamoré","Sony Music Latin",45,52,44,"47234"
52,"spotify:track:2KklXplRtxMsBYo474Es0w","Ofenbach","Be Mine","Elektra France",5,60,206,"47068"
53,"spotify:track:0gn0krlJTSSZvnMxh2ITHY","Sofiane","Mon p'tit loup","Universal Music Division Capitol Music France",9,51,114,"45174"
54,"spotify:track:29rRQITL0TE9bcoi66i2O5","Lacrim, GIMS","Ce soir ne sors pas","Universal Music Division Capitol Music France",54,54,30,"44803"
55,"spotify:track:6EpRaXYhGOB3fj4V2uDkMJ","Liam Payne, Quavo","Strip That Down (feat. Quavo)","Capitol Records UK / EMI",31,53,76,"44340"
56,"spotify:track:6HUnnBwYZqcED1eQztxMBN","Martin Jensen","Solo Dance","Intercord",51,58,175,"44290"
57,"spotify:track:0qYTZCo5Bwh1nsUFGZP3zn","Maluma","Felices los 4","Sony Music Latin",55,62,69,"44073"
58,"spotify:track:6De0lHrwBfPfrhorm9q1Xl","Danny Ocean","Me Rehúso","Atlantic Records",52,59,61,"44002"
59,"spotify:track:0afhq8XCExXpqazXczTSve","Ed Sheeran","Galway Girl","Atlantic Records UK",8,64,156,"43078"
60,"spotify:track:6y2Kaz9QI01XBKJ8mTb7Pf","Rag'n'Bone Man","Skin","Best Laid Plans/Columbia",28,65,183,"42534"
61,"spotify:track:6QfPyKRfSQBb3ccajHioEm","L'Algérino","Les menottes (Tching Tchang Tchong)","Black Pearl Music",61,61,66,"42263"
62,"spotify:track:75UFzgBCaVwJJ4IVIaatpe","Damso","N. J Respect R","Universal Music Division Carthage Music",7,57,100,"41689"
63,"spotify:track:4HvYhaXDmmAW6ZmPcgPZca","Damso","B. #QuedusaalVie","Universal Music Division Carthage Music",2,55,100,"41465"
64,"spotify:track:57U26FwUclMqyZ5ylnPpw1","Damso","Α. Nwaar Is The New Black","Universal Music Division Carthage Music",1,56,102,"41201"
65,"spotify:track:36rJPxwMaQV4EL7N8f8UXO","Djadja & Dinaz, DJ Babs","Maléfique","Carré-Music",49,67,16,"40808"
66,"spotify:track:3VdDQkNCQKPAL4nZlFKWlN","Benash, Booba","Ghetto","Universal Music Division Capitol Music France",9,63,156,"40456"
67,"spotify:track:5axLlrd4jZZs0eAKIeNtOX","Sadek, Niska","En leuleu (feat. Niska)","Rec. 118 / Industreet",61,66,31,"39513"
68,"spotify:track:00X2yv2vrtritPt2CZnUTZ","PNL","Bené","QLF Records",3,70,217,"39322"
69,"spotify:track:3ebXMykcMXOcLeJ9xZ17XH","Martin Garrix, Dua Lipa","Scared to Be Lonely","Epic Amsterdam",7,75,191,"39066"
70,"spotify:track:0U050yYuyc2Gq9hrfvfEq8","Hornet La Frappe","Gramme 2 peuf","Rec. 118 / Diez Peufra",28,71,169,"38660"
71,"spotify:track:4GCIYE1x1TWJCChPkpy9by","PNL","Onizuka","QLF Records",10,69,217,"38579"
72,"spotify:track:4c2W3VKsOFoIg2SFaO6DY5","Rita Ora","Your Song","Atlantic Records UK",52,76,65,"38036"
73,"spotify:track:7KXjTSCq5nL1LoYtL7XAwS","Kendrick Lamar","HUMBLE.","Aftermath",3,68,128,"37927"
74,"spotify:track:1kgws2l8gsvDhtsVyzWbu9","Parcels","Overnight","Because Music",63,74,35,"37732"
75,"spotify:track:0z18wqbjuXTxzaNm4oegU2","Lacrim, Booba","Oh bah oui","Universal Music Division Capitol Music France",1,72,128,"37633"
76,"spotify:track:61WbtB6ujkpNAsAf5LjF4b","Katy Perry, Migos","Bon Appétit","Capitol Records (CAP)",27,79,89,"37102"
77,"spotify:track:0A9wC1WP0tzt4TQTZdBirz","Louane","On était beau","Universal Music Division Island Def Jam",74,77,11,"37020"
78,"spotify:track:6RUKPb4LETWmmr3iAEQktW","The Chainsmokers, Coldplay","Something Just Like This","Disruptor Records/Columbia",6,73,164,"36390"
79,"spotify:track:5xhJmd0I15jFcEdqxfCzKk","The Chainsmokers, Louane","It Won't Kill Ya","Disruptor Records/Columbia",24,83,121,"35306"
80,"spotify:track:4JIOC5P1G1NjhRJ2JSXm41","Dabs","Ouloulou","Colored Music",56,78,191,"34939"
81,"spotify:track:3VvXGTB7qzTJ0nBOBwiH9X","Sadek","Dans la lune","Rec. 118 / Industreet",73,80,79,"34201"
82,"spotify:track:00cbRAOr6wTPE9WBMejhiM","Mister V, Hayce Lemsi, Volts Face","Space Jam","Hey Pelo Records",2,81,79,"33905"
83,"spotify:track:3vRKEsv161Ekp1ASrIh70L","MHD","Bravo","Universal Music Division Capitol Music France",35,85,51,"33896"
84,"spotify:track:2eMwDehkIC1j68U6FA3Eiq","Lil Uzi Vert","XO Tour Llif3","Generation Now/Atlantic",71,84,102,"33611"
85,"spotify:track:5GXAXm5YOmYT0kL5jHvYBt","The Weeknd, Daft Punk","I Feel It Coming","The Weeknd/Lyric",6,82,217,"33424"
86,"spotify:track:0FuTx2s3YH1ppmtiM6l0zI","JP Cooper","September Song","Universal-Island Records Ltd.",50,92,177,"32831"
87,"spotify:track:2hMBPbAkEC0wu6iylhdiaJ","DJ Sem, Marwa Loud","Mi Corazón","Universal Music Division Island Def Jam",87,87,24,"32824"
88,"spotify:track:1YcY5Iiv3Ab68QC2rMKuBP","Niska","J'suis dans l'baye","Universal Music Division Capitol Music France",73,86,121,"31861"
89,"spotify:track:33N0DD1cmllJxjKQvJkFo2","Dosseh","PDCV (Pas dans cette vie)","Universal Music Division Capitol Music France",77,88,22,"31125"
90,"spotify:track:2KkD7TsSOHyG8sXdhLkTf8","SCH","MAC 11","Universal Music Division Capitol Music France",16,89,70,"30615"
91,"spotify:track:5lvYLKGuBWNTpk505KUr1E","Alonzo","Bagarre","Universal Music Division Island Def Jam",76,91,37,"30364"
92,"spotify:track:5zCO1EU3KpM2tsFaZdu9vq","Kaaris","Boyz N The Hood","Universal Music Division Virgin Records",79,93,155,"29646"
93,"spotify:track:5FRCTmIl1SIie075FoVsqA","Kalash Criminel, Jul","Je ne comprends pas","Universal Music Division Capitol Music France",48,95,79,"29543"
94,"spotify:track:0hNduWmlWmEmuwEFcYvRu1","Petit Biscuit","Sunset Lover","Petit Biscuit",2,90,217,"29230"
95,"spotify:track:5Ik150YpJw117EFg5gF9lP","Naps","À part ça","Duetti",69,106,81,"29181"
96,"spotify:track:27SdWb2rFzO6GWiYDBTD9j","Sia","Cheap Thrills","Monkey Puzzle Records/RCA Records",27,134,199,"29028"
97,"spotify:track:3yHdlt7YQI9ItRTZU8HbgL","Timal","Vatos","Elektra France",74,97,18,"28988"
98,"spotify:track:1xznGGDReH1oQq0xzbwXa3","Drake, Wizkid, Kyla","One Dance","Cash Money Records/Young Money Ent./Universal Rec.",1,96,217,"28751"
99,"spotify:track:4ysXJQqi5zH0yz1R4sna52","Niska","B.O.C","Universal Music Division Capitol Music France",33,100,149,"28256"
100,"spotify:track:2QXNsj3HmqbDqbw0R9F5zo","Sofiane","Toka","Universal Music Division Capitol Music France",14,98,114,"28239"
101,"spotify:track:337NxxJAxClIStxYcu7HNG","Naps, 13ème Art, Graya, Kalif, Raisse, YL, Dika","Pochon bleu","Duetti",76,101,91,"28132"
102,"spotify:track:1VuThr0P0HnW0RQLgBRWhi","MHD","Afro Trap Pt. 9 (Faut les wet)","Universal Music Division Capitol Music France",62,99,23,"28095"
103,"spotify:track:00lNx0OcTJrS3MKHcB80HY","Jax Jones, RAYE","You Don't Know Me (feat. RAYE)","Polydor Records",3,104,171,"27067"
104,"spotify:track:450XNJRan5KMcpueK59gGo","BMYE, Naza, KeBlack, Youssoupha, Hiro, Jaymax, DJ Myst","Pourquoi chérie","Bomaye musik",104,111,39,"27029"
105,"spotify:track:6HViP4DVYa8gQtxLndmhwu","Møme, Merryn Jeann","Aloha","Universal Music Division Virgin Records",20,114,217,"27026"
106,"spotify:track:584FSBgVVOd1lO9fsdA35k","MMZ","Ma bulle","TPLG Records",104,107,9,"26714"
107,"spotify:track:6nGSXuZrE5P7gSvtJs4unC","Damso","Κ. Kin la belle","Universal Music Division Carthage Music",12,103,100,"26701"
108,"spotify:track:1i03F8e3iYugaWN1r1QCbU","Niro","Sors de ma tête","Universal Music Division Capitol Music France",79,108,30,"26676"
109,"spotify:track:376JSYpMMIJteMBozHUix0","Jul","Je ne me vois pas briller","D'Or et de Platine",29,110,81,"26510"
110,"spotify:track:7BCZh8tgdw8HuUsvqlNBDR","Bigflo & Oli","Alors alors","Universal Music Division Virgin Records",51,105,50,"26499"
111,"spotify:track:0lkQfsTMmtDA37tjjew9n0","PNL","Naha","QLF Records",22,109,217,"26464"
112,"spotify:track:78rIJddV4X0HkNAInEcYde","Starley, Ryan Riback","Call on Me - Ryan Riback Remix","Central Station Records",2,94,217,"26397"
113,"spotify:track:5urhEtesorARjZhjSaFntn","Damso","Ζ. Kietu","Universal Music Division Carthage Music",6,102,100,"26174"
114,"spotify:track:4rrzxq356QDANDVd0SB1Dq","Mister V","Top album","Hey Pelo Records",3,113,99,"26138"
115,"spotify:track:3kxfsdsCpFgN412fpnW85Y","Childish Gambino","Redbone","Glassnote - VMG",114,118,60,"26020"
116,"spotify:track:4J6xvZhJh26lmAEAXGDCKu","Naive New Beaters, Izïa","Heal Tomorrow","Universal Music Division Capitol Music France",28,137,201,"25872"
117,"spotify:track:5YIbA6i8pPUnl6CDpVDa63","Dadju","Reine","Universal Music Division Capitol Music France",98,116,91,"25631"
118,"spotify:track:63z6p4gpgnpZprANkpBIHH","Dosseh, Booba","Infréquentables","Universal Music Division Capitol Music France",18,115,217,"25027"
119,"spotify:track:4Hg1iEa7zg4Z0l2oxpARIL","Naps","Ciao","Duetti",92,121,78,"24979"
120,"spotify:track:6mICuAdrwEjh6Y6lroV2Kg","Shakira, Maluma","Chantaje (feat. Maluma)","Sony Music Latin",13,119,216,"23876"
121,"spotify:track:45KqDHTOJtIM53QR1gPGTa","Rilès","Brothers","RILÈSUNDAYZ",38,141,104,"23833"
122,"spotify:track:6ATkHaUrIJUtwyhoGMmQgw","Damso","Δ. Dieu ne ment jamais","Universal Music Division Carthage Music",6,117,100,"23586"
123,"spotify:track:7gXWIxX7rUtKGNtRkot8p3","RIDSA","Mamamia","Wagram Music / W Lab",121,124,66,"23547"
124,"spotify:track:1Ylz8QTIwBUbO20z8VJyop","Naza","MMM","Bomaye musik",122,129,22,"23499"
125,"spotify:track:1yxgsra98r3qAtxqiGZPiX","Travis Scott","BUTTERFLY EFFECT","Cactus Jack / Epic",116,125,18,"23461"
126,"spotify:track:5t9fmZx0pcNxLykKTv6eOe","Nekfeu, Sneazzy, S.Pri Noir","Saturne","Universal Music Division Carthage Music",5,127,217,"22958"
127,"spotify:track:2Z8WuEywRWYTKe1NybPQEW","Twenty One Pilots","Ride","Fueled By Ramen",19,146,204,"22952"
128,"spotify:track:0UXW6ihyeYHfb4jae7QxGl","DTF","100 rêves","QLF Records",57,126,90,"22914"
129,"spotify:track:5knuzwU65gJK7IF5yJsuaW","Clean Bandit, Anne-Marie, Sean Paul","Rockabye (feat. Sean Paul & Anne-Marie)","Atlantic Records UK",2,122,217,"22549"
130,"spotify:track:7syABtsvHvD3nO7OG91Ani","Sofiane","Tout l'monde s'en fout","Suther Kane",3,130,191,"22482"
131,"spotify:track:5UOGzIMvxXyRZIWBbqDcpU","PNL","DA","QLF Records",58,133,217,"22401"
132,"spotify:track:2ixB59eXNIH8qyEMP15IOj","DJ Hamida, Lartiste","C'est une frappe","Meknessi Style Records",132,138,11,"22390"
133,"spotify:track:0KKkJNfGyhkQ5aFogxQAPU","Bruno Mars","That's What I Like","Atlantic Records",31,131,161,"22058"
134,"spotify:track:2aFiaMXmWsM3Vj72F9ksBl","DNCE","Cake By The Ocean","Joseph Jonas/Republic Records",117,-1,15,"21861"
135,"spotify:track:1sCxVKWImDZSZKvG0U9B23","Selena Gomez","Bad Liar","Selena Gomez PS",51,123,78,"21637"
136,"spotify:track:2Vd1vVQaBilW0O6nmU5BkH","Vianney","Je m'en vais","Tôt Ou Tard",2,128,217,"21470"
137,"spotify:track:4myoVer3cPAUqBzDigYf7A","Damso","Λ. Lové","Universal Music Division Carthage Music",11,135,100,"21361"
138,"spotify:track:5B13mNIiknPY2zKCyn1O6L","S.Pri Noir","Skywalker","Believe Recordings",121,136,110,"21326"
139,"spotify:track:0tICYNayWWhH9GPeFrfjfD","Kungs, Cookin' On 3 Burners","This Girl (Kungs Vs. Cookin' On 3 Burners)","Universal Music Division Polydor France",80,151,198,"21231"
140,"spotify:track:7hDc8b7IXETo14hHIHdnhd","Drake","Passionfruit","Cash Money Records/Young Money Ent./Universal Rec.",2,147,140,"21168"
141,"spotify:track:4kKJ5CjwCtksszPMntho4N","Nekfeu","Mauvaise graine","Universal Music Division Carthage Music",1,139,217,"21140"
142,"spotify:track:7FXXVMGfMLy1IkmgDIZJBp","Deen Burbigo, Nekfeu","Tu rêves","Universal Music Division Virgin Records",55,140,63,"21127"
143,"spotify:track:58zsLZPvfflaiIbNWoA22O","Rag'n'Bone Man","Human","Best Laid Plans/Columbia",5,120,217,"21078"
144,"spotify:track:4pdPtRcBmOSQDlJ3Fk945m","DJ Snake, Justin Bieber","Let Me Love You","DJ Snake Def Jam",7,132,217,"21039"
145,"spotify:track:36giaa7roszmJh3okF5efv","Jul","C'est pas ma faute","D'Or et de Platine",46,143,37,"20917"
146,"spotify:track:7A3rNO7cmVKM3boOmIBwtj","S.Pri Noir","Highlander","Believe Recordings",115,150,49,"20609"
147,"spotify:track:33dLYyEIRqEipCuLb8z1l0","Lacrim","La dolce vita","Universal Music Division Capitol Music France",6,149,128,"20507"
148,"spotify:track:0lMbuWUpfTWhEmOKxppEau","Calvin Harris, Future, Khalid, Funk Wav","Rollin (feat. Future & Khalid)","Columbia",44,142,82,"20416"
149,"spotify:track:6x8j5V85ZJHtvOSjSamcVc","MHD","Afro Trap Pt. 7 (La puissance)","Universal Music Division Capitol Music France",3,163,217,"20411"
150,"spotify:track:17Fd6Yb7mSbinKG8LoWfFl","Mike Posner, Seeb","I Took A Pill In Ibiza - Seeb Remix","Monster Mountain, LLC / Island",18,152,214,"20220"
151,"spotify:track:7F9vK8hNFMml4GtHsaXui6","Louis Tomlinson, Bebe Rexha, Digital Farm Animals","Back to You (feat. Bebe Rexha & Digital Farm Animals)","Syco Music",114,148,12,"19997"
152,"spotify:track:1iDQ2zCOU1uYeR8QcpqUZb","Booba","DKR - Bonus Track","Universal Music Distribution Deal",14,161,213,"19984"
153,"spotify:track:2ekn2ttSfGqwhhate0LSR0","Dua Lipa","New Rules","Warner Records",141,144,6,"19979"
154,"spotify:track:6tM2eT1MabbdZUFtiEBdjb","Lorenzo","Freestyle du sale","MFC",154,157,24,"19878"
155,"spotify:track:6iTVIAqZpHmCK9jrpDyDVo","Kungs, Ephemerals","I Feel So Bad","Universal Music Division Polydor France",23,164,204,"19817"
156,"spotify:track:2sOrroHqKbYFP2MfHxhQMc","Rim'K","Cellophané","MB",51,154,217,"19792"
157,"spotify:track:2XOXx2U5IIoBRPlmGgDqj8","Polo & Pan","Canopée","Universal Music Division Virgin Records Distribution Deal",150,167,14,"19701"
158,"spotify:track:3a1lNhkSLSkpJE4MSHpDu9","Post Malone, Quavo","Congratulations","Mercury Records/Republic Owned",132,153,55,"19534"
159,"spotify:track:0L7loeTIg6akW84aEQZpCT","Major Lazer, Nyla, Fuse ODG","Light It Up","Third Pardee Records",45,158,187,"19487"
160,"spotify:track:5NZpY9WeWFtlHVgepfCamX","PNL","Dans la légende","QLF Records",45,159,215,"19463"
161,"spotify:track:1MUxJxub6ovS0rzTHRgyoF","MHD","Afro Trap Pt. 8 (Never)","Universal Music Division Capitol Music France",2,168,163,"19336"
162,"spotify:track:1Slwb6dOYkBlWal1PGtnNg","Ed Sheeran","Thinking out Loud","Atlantic Records UK",42,-1,60,"19075"
163,"spotify:track:3cFsmM51N5zMAuu1nNY4Tw","Sean Paul, Dua Lipa","No Lie","Universal-Island Records Ltd.",14,155,175,"18865"
164,"spotify:track:2DgbGKxExW9p3ZmsBDOXBg","Lartiste","Pardonner","Purple Money / Zayn Corporation",164,174,15,"18848"
165,"spotify:track:2hgzdQdnfWwtdpZbhZlV72","Jennifer Lopez","Ain't Your Mama","Epic/Nuyorican Productions",33,169,125,"18833"
166,"spotify:track:3fHXUNVKNZQ4WaUGLwWxHP","Damso, Booba","Paris c'est loin","Universal Music Division Carthage Music",67,162,216,"18830"
167,"spotify:track:5ZtoiFGlZ3tur8NJAMn0ws","Rilès","THANK GOD","Republic Records",53,186,102,"18812"
168,"spotify:track:6OZh916QF8XNunWaP97WEZ","Jonas Blue, Dakota","Fast Car","Positiva",53,-1,37,"18746"
169,"spotify:track:5nQHYFZC2mcUF1ouFBPsz1","Scridge","Pour walou","Snafu Records",121,176,102,"18648"
170,"spotify:track:4S1ZmpEshXG3S0OLdodb1W","Sneazzy, Nekfeu","Skurt Cobain","Believe Recordings",86,165,204,"18595"
171,"spotify:track:4WjH9Bzt3kx7z8kl0awxh4","Major Lazer, MØ, DJ Snake","Lean On (feat. MØ & DJ Snake)","Third Pardee Records",66,180,131,"18574"
172,"spotify:track:6dbdxneD4mLKDgXJ6GQkJm","Soprano","Roule","Rec. 118",54,181,159,"18493"
173,"spotify:track:64I0PKLFEKlcvc7fEVUGq0","Izzy Bizu","White Tiger - Single Version","Epic",86,-1,72,"18403"
174,"spotify:track:0u6HzAVFUBiKslzPF9G9vd","Ninho","Dis-moi que tu m'aimes","Rec. 118 / Mal Luné Music",66,178,196,"18335"
175,"spotify:track:6wR97bho2QoIiP5wxNxtQz","Djadja & Dinaz","C'est la même","Carré-Music",25,171,145,"18282"
176,"spotify:track:1oXiNxPogfnfVMiqGdr2Pv","Jul, Kalash Criminel","Cagoulé","D'Or et de Platine",44,173,37,"18237"
177,"spotify:track:1wxBP4KwMN2UyMJc6S0GJn","Naza","A Gogo","Bomaye musik",166,190,23,"18215"
178,"spotify:track:4I2Z1gxRN4f55EmMwhzKxK","Benash, Shay, Damso","Ivre","Universal Music Division Capitol Music France",88,172,89,"18201"
179,"spotify:track:46GGxd8TVRt6FjUBfCavVT","X Ambassadors","Renegades","Kid Ina Korner / Interscope",150,-1,3,"18095"
180,"spotify:track:7qCAVkHWZkF44OzOUKf8Cr","Nicky Jam, Enrique Iglesias","El Perdón (with Enrique Iglesias)","Sony Music Latin",140,-1,9,"18019"
181,"spotify:track:0nhKXS1KL8ffn40Un1q91D","Sofiane","Poto","Universal Music Division Capitol Music France",35,175,84,"18015"
182,"spotify:track:5qqabIl2vWzo9ApSC317sa","Oasis","Wonderwall - Remastered","Big Brother Recordings Ltd",119,-1,4,"17934"
183,"spotify:track:5eqK0tbzUPo2SoeZsov04s","21 Savage","Bank Account","Slaughter Gang, LLC/Epic Records",183,189,3,"17883"
184,"spotify:track:2qQ9rKLbylbmmmR9RUSdWI","Hornet La Frappe","Double H","MyMedia Agency",100,182,117,"17846"
185,"spotify:track:0NUvPSk4VzBW0ClqgGxNRj","Vald, Damso","Vitrine","Universal Music Division Capitol Music France",29,160,188,"17818"
186,"spotify:track:3NdDpSvN911VPGivFlV5d0","ZAYN, Taylor Swift","I Don’t Wanna Live Forever (Fifty Shades Darker)","Taylor Swift",2,156,215,"17716"
187,"spotify:track:1rIKgCH4H52lrvDcz50hS8","Zara Larsson","Lush Life","Epic/Record Company TEN",24,170,90,"17658"
188,"spotify:track:0FSmLzJo6mRBJfh7JbJjuC","Fally Ipupa, Aya Nakamura","Bad Boy (feat. Aya Nakamura)","Elektra France",188,195,4,"17641"
189,"spotify:track:6D8tdYo3mBOIUrWAk8wOVo","Alonzo, MHD","Feu d'artifice","Universal Music Division Island Def Jam",44,188,141,"17622"
190,"spotify:track:1OYlOIc7UdRBe1daHclsRU","Bigflo & Oli","Personne","Universal Music Division Virgin Records",59,177,47,"17566"
191,"spotify:track:2cnKEkpVUSV4wnjQiTWfH6","Wisin, Ozuna","Escápate Conmigo (feat. Ozuna)","Sony Music Latin",187,196,9,"17398"
192,"spotify:track:1uaAq8pSghvpVxlrOrgdeO","Lomepal","Yeux disent","Pineale Prod - Grand Musique Management",115,184,41,"17356"
193,"spotify:track:11hj8c8BCRd5ND3CRhZSvt","Nekfeu","Squa","Universal Music Division Carthage Music",2,191,199,"17315"
194,"spotify:track:3AbR9rS5iPPPG5F5TJtLMs","Sadek, Brulux","La Bise (feat. Brulux)","Rec. 118 / Industreet",59,187,211,"17252"
195,"spotify:track:6O85MfGECKBqAK2MgSbCaj","Martin Solveig, Ina Wroldsen","Places","EMI",35,192,142,"17090"
196,"spotify:track:0y1QJc3SJVPKJ1OvFmFqe6","KALEO","Way down We Go","Elektra (NEK)",12,166,181,"17057"
197,"spotify:track:0ban5QRXUveaKtQPGuaoQ9","Kaaris","Tchoin","Universal Music Division Virgin Records",2,199,210,"17002"
198,"spotify:track:6QUDs5wTqWwI4Ed68GLdlC","Ninho","Roro","Rec. 118 / Mal Luné Music",67,194,104,"16928"
199,"spotify:track:0fBxgiQe76HZFFqN2FUUpw","Damso","Η. Gova","Universal Music Division Carthage Music",9,185,100,"16841"
200,"spotify:track:2GP3ncrLU8jeyrnLTi9uZ1","Keen' V","Elle a","Warner (France)",122,198,26,"16571"
