rank,uri,artist_names,track_name,source,peak_rank,previous_rank,days_on_chart,streams,lastfm_tags,album,release_date,days_since_release
20,spotify:track:2OzhQlSqBEmt7hmkYxfT6m,"Taylor Swift, Post Malone",Fortnight (feat. Post Malone),Taylor Swift,1,20,58,3586382,pop; best of 2024; soty; synthpop; singer-songwriter,The Tortured Poets Department (Webstore Exclusive),,
23,spotify:track:1BxfuPKGuaTgP7aM0Bbdwr,Taylor Swift,Cruel Summer,Taylor Swift,2,24,496,3366831,electropop; pop; synthpop; industrial pop; synthwave,Lover,,
37,spotify:track:4q5YezDOIPcoLr8R81x9qy,Taylor Swift,I Can Do It With a Broken Heart,Taylor Swift,3,34,58,2529522,pop; best of 2024; synthpop; dance-pop; soty,THE TORTURED POETS DEPARTMENT,,
92,spotify:track:2F3N9tdombb64aW6VtZOdo,Taylor Swift,Down Bad,Taylor Swift,2,81,58,1642613,pop; synthpop; best of 2024; love at first listen; pop perfect,THE TORTURED POETS DEPARTMENT,,
93,spotify:track:0W0iAC1VGlB82PI6elxFYf,Taylor Swift,Guilty as Sin?,Taylor Swift,11,90,58,1640159,pop; best of 2024; singer-songwriter; pop rock; soty,THE TORTURED POETS DEPARTMENT,,
154,spotify:track:36t6frENUtCYKuZus6aYDO,Taylor Swift,Who’s Afraid of Little Old Me?,Taylor Swift,9,142,58,1388529,love at first listen; pop; best of 2024; pop rock; taylor swift,THE TORTURED POETS DEPARTMENT [Clean] [Clean],,
