rank,uri,artist_names,track_name,source,peak_rank,previous_rank,days_on_chart,streams,lastfm_tags,album,release_date,days_since_release
13,spotify:track:3hUxzQpSfdDqwM3ZTFQY0K,Taylor Swift,august,Taylor Swift,4,82,432,4034372,dream pop; folk; folk pop; indie pop; indie,folklore: the long pond studio sessions (from the Disney+ special),,
19,spotify:track:1BxfuPKGuaTgP7aM0Bbdwr,Taylor Swift,Cruel Summer,Taylor Swift,2,19,543,3127993,electropop; pop; synthpop; industrial pop; synthwave,Lover,,
39,spotify:track:2OzhQlSqBEmt7hmkYxfT6m,"Taylor Swift, Post Malone",Fortnight (feat. Post Malone),Taylor Swift,1,39,105,2350343,pop; best of 2024; soty; synthpop; singer-songwriter,The Tortured Poets Department (Webstore Exclusive),,
76,spotify:track:4q5YezDOIPcoLr8R81x9qy,Taylor Swift,I Can Do It With a Broken Heart,Taylor Swift,3,70,105,1804438,pop; best of 2024; synthpop; dance-pop; soty,THE TORTURED POETS DEPARTMENT,,
132,spotify:track:1dGr1c8CrMLDpV6mPbImSI,Taylor Swift,Lover,Taylor Swift,2,159,483,1443999,pop; country; love; indie folk; country pop,You Belong With Me,,
138,spotify:track:4R2kfaDFhslZEMJqAFNpdd,Taylor Swift,cardigan,Taylor Swift,1,-1,504,1428488,folk pop; folk; chamber pop; singer-songwriter; indie,Now That's What I Call Music! Vol. 76,,
