rank,uri,artist_names,track_name,source,peak_rank,previous_rank,days_on_chart,streams
1,"spotify:track:2UZW9WOPXdxw9YMG1bebS8","Damso","Θ. Macarena","Universal Music Division Carthage Music",1,1,39,"170370"
2,"spotify:track:5CtI0qwDJkDQGwXD1H1cLb","Luis Fonsi, Daddy Yankee, Justin Bieber","Despacito - Remix","UMLE - Latino",2,3,49,"130808"
3,"spotify:track:7qiZfU4dY1lWllzX7mPBI3","Ed Sheeran","Shape of You","Atlantic Records UK",1,2,151,"127749"
4,"spotify:track:3DXncPQOG4VBw3QHh3S817","DJ Khaled, Justin Bieber, Quavo, Chance the Rapper, Lil Wayne","I'm the One (feat. Justin Bieber, Quavo, Chance the Rapper & Lil Wayne)","Epic/We The Best",4,8,39,"105849"
5,"spotify:track:4fwtP5khM1iEoa6BP1QQsX","Lartiste, Awa Imani","Chocolat (feat. Awa Imani)","Purple Money / Zayn Corporation",4,4,120,"94555"
6,"spotify:track:6kex4EBAj0WHXDKZMEJaaF","Jason Derulo, Nicki Minaj, Ty Dolla $ign","Swalla (feat. Nicki Minaj & Ty Dolla $ign)","Beluga Heights/Warner Records",6,6,72,"94470"
7,"spotify:track:3rOSwuTsUlJp0Pu0MkN8r8","Future","Mask Off","Epic/Freebandz/A1",2,5,103,"91196"
8,"spotify:track:4iLqG9SeJSnt0cSPICSjxv","Charlie Puth","Attention","Artist Partner",8,13,45,"88370"
9,"spotify:track:4aWmUDTfIPGksMNLV2rQP2","Luis Fonsi, Daddy Yankee","Despacito","UMLE - Latino",2,7,134,"84832"
10,"spotify:track:1x5sYLZiu9r5E43kMlt9f8","Clean Bandit, Zara Larsson","Symphony (feat. Zara Larsson)","Atlantic Records UK",8,10,76,"84033"
11,"spotify:track:57U26FwUclMqyZ5ylnPpw1","Damso","Α. Nwaar Is The New Black","Universal Music Division Carthage Music",1,9,41,"83345"
12,"spotify:track:03aduXwm6cTqO9bb4XFQ2b","Damso","Ε. Signaler","Universal Music Division Carthage Music",5,11,39,"83312"
13,"spotify:track:1E3zyoTHtJzsu5CjwIFIhY","Damso","Γ. Mosaïque solitaire","Universal Music Division Carthage Music",3,12,39,"79381"
14,"spotify:track:7nKBxz47S9SD79N086fuhn","Enrique Iglesias, Descemer Bueno, Zion & Lennox","SUBEME LA RADIO","RCA Records/Sony Music International/Sony Music Latin",14,21,79,"75446"
15,"spotify:track:00cbRAOr6wTPE9WBMejhiM","Mister V, Hayce Lemsi, Volts Face","Space Jam","Hey Pelo Records",2,14,18,"70699"
16,"spotify:track:0gn0krlJTSSZvnMxh2ITHY","Sofiane","Mon p'tit loup","Universal Music Division Capitol Music France",9,15,53,"70370"
17,"spotify:track:0dA2Mk56wEzDgegdC6R17g","Zedd, Alessia Cara","Stay","UMGRI Interscope",15,20,100,"68061"
18,"spotify:track:3eR23VReFzcdmS7TYCrhCe","Kygo, Selena Gomez","It Ain't Me (with Selena Gomez)","Kygo",2,18,110,"67951"
19,"spotify:track:4HvYhaXDmmAW6ZmPcgPZca","Damso","B. #QuedusaalVie","Universal Music Division Carthage Music",2,19,39,"66972"
20,"spotify:track:78rIJddV4X0HkNAInEcYde","Starley, Ryan Riback","Call on Me - Ryan Riback Remix","Central Station Records",2,16,156,"65335"
21,"spotify:track:0tKcYR2II1VCQWT79i5NrW","Imagine Dragons","Thunder","Kid Ina Korner / Interscope",21,25,27,"64795"
22,"spotify:track:1NDxZ7cFAo481dtYWdrUnR","Maggie Lindemann, Cheat Codes, CADE","Pretty Girl - Cheat Codes X CADE Remix","300 Entertainment",17,17,21,"63889"
23,"spotify:track:75UFzgBCaVwJJ4IVIaatpe","Damso","N. J Respect R","Universal Music Division Carthage Music",7,23,39,"62498"
24,"spotify:track:2KklXplRtxMsBYo474Es0w","Ofenbach","Be Mine","Elektra France",5,24,145,"61507"
25,"spotify:track:00lNx0OcTJrS3MKHcB80HY","Jax Jones, RAYE","You Don't Know Me (feat. RAYE)","Polydor Records",3,22,110,"61460"
26,"spotify:track:6RUKPb4LETWmmr3iAEQktW","The Chainsmokers, Coldplay","Something Just Like This","Disruptor Records/Columbia",6,27,103,"61258"
27,"spotify:track:5xhJmd0I15jFcEdqxfCzKk","The Chainsmokers, Louane","It Won't Kill Ya","Disruptor Records/Columbia",24,26,60,"58524"
28,"spotify:track:7tr2za8SQg2CI8EDgrdtNl","Calvin Harris, Frank Ocean, Migos, Funk Wav","Slide (feat. Frank Ocean & Migos)","Columbia",24,28,102,"58313"
29,"spotify:track:79cuOz3SPQTuFrp8WgftAu","Shawn Mendes","There's Nothing Holdin' Me Back","Island Records",28,35,46,"58236"
30,"spotify:track:4rrzxq356QDANDVd0SB1Dq","Mister V","Top album","Hey Pelo Records",3,29,38,"58164"
31,"spotify:track:3cFsmM51N5zMAuu1nNY4Tw","Sean Paul, Dua Lipa","No Lie","Universal-Island Records Ltd.",14,31,114,"57470"
32,"spotify:track:3ebXMykcMXOcLeJ9xZ17XH","Martin Garrix, Dua Lipa","Scared to Be Lonely","Epic Amsterdam",7,30,130,"56034"
33,"spotify:track:3VdDQkNCQKPAL4nZlFKWlN","Benash, Booba","Ghetto","Universal Music Division Capitol Music France",9,33,95,"55494"
34,"spotify:track:0NiXXAI876aGImAd6rTj8w","Jonas Blue, William Singe","Mama","UMOD (Universal Music On Demand)",34,43,9,"54692"
35,"spotify:track:6jA8HL9i4QGzsj6fjoxp8Y","Martin Garrix, Troye Sivan","There for You","Epic Amsterdam",35,41,11,"53900"
36,"spotify:track:2Gl0FzuLxflY6nPifJp5Dr","Kygo, Ellie Goulding","First Time","Kygo",23,36,37,"53185"
37,"spotify:track:5GXAXm5YOmYT0kL5jHvYBt","The Weeknd, Daft Punk","I Feel It Coming","The Weeknd/Lyric",6,32,156,"52168"
38,"spotify:track:61WbtB6ujkpNAsAf5LjF4b","Katy Perry, Migos","Bon Appétit","Capitol Records (CAP)",37,37,28,"52151"
39,"spotify:track:5urhEtesorARjZhjSaFntn","Damso","Ζ. Kietu","Universal Music Division Carthage Music",6,34,39,"51970"
40,"spotify:track:7KXjTSCq5nL1LoYtL7XAwS","Kendrick Lamar","HUMBLE.","Aftermath",3,38,67,"49616"
41,"spotify:track:1ssmjAYSU5PbmsjLq5yrNH","Sia","Never Give Up (From ""Lion"" Soundtrack)","Masterworks",22,44,87,"49337"
42,"spotify:track:2QXNsj3HmqbDqbw0R9F5zo","Sofiane","Toka","Universal Music Division Capitol Music France",14,40,53,"48692"
43,"spotify:track:6y2Kaz9QI01XBKJ8mTb7Pf","Rag'n'Bone Man","Skin","Best Laid Plans/Columbia",28,39,122,"48347"
44,"spotify:track:6nGSXuZrE5P7gSvtJs4unC","Damso","Κ. Kin la belle","Universal Music Division Carthage Music",12,45,39,"47936"
45,"spotify:track:6ATkHaUrIJUtwyhoGMmQgw","Damso","Δ. Dieu ne ment jamais","Universal Music Division Carthage Music",6,42,39,"47829"
46,"spotify:track:6O85MfGECKBqAK2MgSbCaj","Martin Solveig, Ina Wroldsen","Places","EMI",35,46,109,"47016"
47,"spotify:track:0U050yYuyc2Gq9hrfvfEq8","Hornet La Frappe","Gramme 2 peuf","Rec. 118 / Diez Peufra",28,48,108,"44908"
48,"spotify:track:00X2yv2vrtritPt2CZnUTZ","PNL","Bené","QLF Records",3,47,156,"44539"
49,"spotify:track:1Eck97uRMlprKOOJN9oO1E","G-Eazy, Kehlani","Good Life (with G-Eazy & Kehlani)","Artist Partner",46,50,56,"44108"
50,"spotify:track:6D0b04NJIKfEMg040WioJQ","Julia Michaels","Issues","J/Republic",34,53,114,"44016"
51,"spotify:track:2eqHbYG0r90Y3LpZVjQOJX","HEDIA, Kristen Marie","Your Mind (feat. Kristen Marie)","Warner (France)",32,60,81,"43962"
52,"spotify:track:7syABtsvHvD3nO7OG91Ani","Sofiane","Tout l'monde s'en fout","Suther Kane",3,52,130,"43308"
53,"spotify:track:6iTVIAqZpHmCK9jrpDyDVo","Kungs, Ephemerals","I Feel So Bad","Universal Music Division Polydor France",23,49,147,"43090"
54,"spotify:track:0lMbuWUpfTWhEmOKxppEau","Calvin Harris, Future, Khalid, Funk Wav","Rollin (feat. Future & Khalid)","Columbia",44,51,21,"43036"
55,"spotify:track:0dJhKHDhqu1QYWfMy54G3F","Feder, Daecolm","Back for More (feat. Daecolm)","Elektra France",31,61,36,"41943"
56,"spotify:track:1a5Yu5L18qNxVhXx38njON","Alok, Zeeba, Bruno Martini","Hear Me Now","Spinnin' Records",20,54,141,"41203"
57,"spotify:track:5NNlUMcOEOdoOIwwaWXv0k","Maroon 5, Future","Cold (feat. Future)","Interscope Records*",27,55,108,"39888"
58,"spotify:track:4myoVer3cPAUqBzDigYf7A","Damso","Λ. Lové","Universal Music Division Carthage Music",11,57,39,"39846"
59,"spotify:track:3B54sVLJ402zGa6Xm4YGNe","French Montana, Swae Lee","Unforgettable","Bad Boy Entertainment/Epic Records",56,59,50,"39552"
60,"spotify:track:6dbdxneD4mLKDgXJ6GQkJm","Soprano","Roule","Rec. 118",54,56,101,"39271"
61,"spotify:track:2dqLk7ezV15LEJEwUmEbXB","Marian Hill","Down","Photo Finish / Republic Records",46,72,50,"38505"
62,"spotify:track:4c2W3VKsOFoIg2SFaO6DY5","Rita Ora","Your Song","Atlantic Records UK",62,73,4,"37791"
63,"spotify:track:6Y6mUgZmUadVvfFuoGuy64","Niska","Chasse à l'homme","Universal Music Division Capitol Music France",51,58,39,"37768"
64,"spotify:track:51PIvodunv6NmX5250zxAh","Lady Gaga","The Cure","Interscope",33,68,43,"37362"
65,"spotify:track:4IWAyPf1KMq7JCyGeCjTeH","Imagine Dragons","Whatever It Takes","Kid Ina Korner / Interscope",54,65,23,"36841"
66,"spotify:track:4JIOC5P1G1NjhRJ2JSXm41","Dabs","Ouloulou","Colored Music",56,62,130,"36252"
67,"spotify:track:4GCIYE1x1TWJCChPkpy9by","PNL","Onizuka","QLF Records",10,63,156,"35894"
68,"spotify:track:45KqDHTOJtIM53QR1gPGTa","Rilès","Brothers","RILÈSUNDAYZ",38,66,43,"35544"
69,"spotify:track:0fBxgiQe76HZFFqN2FUUpw","Damso","Η. Gova","Universal Music Division Carthage Music",9,67,39,"34638"
70,"spotify:track:0FuTx2s3YH1ppmtiM6l0zI","JP Cooper","September Song","Universal-Island Records Ltd.",53,69,116,"34352"
71,"spotify:track:0hNduWmlWmEmuwEFcYvRu1","Petit Biscuit","Sunset Lover","Petit Biscuit",2,64,156,"33774"
72,"spotify:track:5FRCTmIl1SIie075FoVsqA","Kalash Criminel, Jul","Je ne comprends pas","Universal Music Division Capitol Music France",48,70,18,"33742"
73,"spotify:track:0UXW6ihyeYHfb4jae7QxGl","DTF","100 rêves","QLF Records",57,74,29,"33533"
74,"spotify:track:1MUxJxub6ovS0rzTHRgyoF","MHD","Afro Trap Pt. 8 (Never)","Universal Music Division Capitol Music France",2,71,102,"32791"
75,"spotify:track:7hDc8b7IXETo14hHIHdnhd","Drake","Passionfruit","Cash Money Records/Young Money Ent./Universal Rec.",2,76,79,"32543"
76,"spotify:track:4ysXJQqi5zH0yz1R4sna52","Niska","B.O.C","Universal Music Division Capitol Music France",33,75,88,"32528"
77,"spotify:track:3AsAuGTaDQzavZZThyYlop","NEIKED, Dyo","Sexual","Polydor Records",26,77,137,"32444"
78,"spotify:track:0z18wqbjuXTxzaNm4oegU2","Lacrim, Booba","Oh bah oui","Universal Music Division Capitol Music France",1,78,67,"31458"
79,"spotify:track:1lQBpwzlkwNiRyCiifKtRA","Damso, Youri Botterman","Ι. Peur d'être père","Universal Music Division Carthage Music",13,80,39,"30884"
80,"spotify:track:0CcQNd8CINkwQfe1RDtGV6","Imagine Dragons","Believer","Kid Ina Korner / Interscope",24,88,117,"30564"
81,"spotify:track:1YcY5Iiv3Ab68QC2rMKuBP","Niska","J'suis dans l'baye","Universal Music Division Capitol Music France",79,79,60,"30508"
82,"spotify:track:6JMdhGfyz9C4kA4mTc6y9C","SCH","Comme si","Universal Music Division Capitol Music France",4,81,60,"30431"
83,"spotify:track:0afhq8XCExXpqazXczTSve","Ed Sheeran","Galway Girl","Atlantic Records UK",8,87,95,"29666"
84,"spotify:track:5knuzwU65gJK7IF5yJsuaW","Clean Bandit, Anne-Marie, Sean Paul","Rockabye (feat. Sean Paul & Anne-Marie)","Atlantic Records UK",2,82,156,"29661"
85,"spotify:track:0rNhRaRsrP0lilQbmdf2xw","Busy P, Mayer Hawthorne","Genie (feat. Mayer Hawthorne) [Radio Edit]","Ed Banger Records",81,90,21,"29164"
86,"spotify:track:337NxxJAxClIStxYcu7HNG","Naps, 13ème Art, Graya, Kalif, Raisse, YL, Dika","Pochon bleu","Duetti",84,85,30,"29080"
87,"spotify:track:0KKkJNfGyhkQ5aFogxQAPU","Bruno Mars","That's What I Like","Atlantic Records",31,84,100,"29030"
88,"spotify:track:1xznGGDReH1oQq0xzbwXa3","Drake, Wizkid, Kyla","One Dance","Cash Money Records/Young Money Ent./Universal Rec.",1,94,156,"28471"
89,"spotify:track:33dLYyEIRqEipCuLb8z1l0","Lacrim","La dolce vita","Universal Music Division Capitol Music France",6,91,67,"28140"
90,"spotify:track:376JSYpMMIJteMBozHUix0","Jul","Je ne me vois pas briller","D'Or et de Platine",44,93,20,"28102"
91,"spotify:track:1FUViuNSldssMIawrOXF2i","Bebe Rexha","I Got You","Warner Records",53,86,144,"27807"
92,"spotify:track:6520aj0B4FSKGVuKNsOCOi","Katy Perry, Skip Marley","Chained To The Rhythm","Capitol Records (CAP)",15,116,116,"27791"
93,"spotify:track:3NdDpSvN911VPGivFlV5d0","ZAYN, Taylor Swift","I Don’t Wanna Live Forever (Fifty Shades Darker)","Taylor Swift",2,111,156,"27745"
94,"spotify:track:3fHXUNVKNZQ4WaUGLwWxHP","Damso, Booba","Paris c'est loin","Universal Music Division Carthage Music",67,96,156,"27683"
95,"spotify:track:3aBUaY8sq3v4N872BTBPfT","MAI LAN","Vampire","Wagram Music / Cinq 7",71,83,21,"27675"
96,"spotify:track:71gEIIqahWVslRCXtN5yhK","Djadja & Dinaz","Déstabilisé","Carré-Music",12,92,113,"27600"
97,"spotify:track:04DysC7XwYiKJqYwGM8mkU","Tess","Love Gun (Radio Edit)","Choke Industry",64,98,134,"27448"
98,"spotify:track:0nhKXS1KL8ffn40Un1q91D","Sofiane","Poto","Universal Music Division Capitol Music France",35,107,25,"27448"
99,"spotify:track:5ZtoiFGlZ3tur8NJAMn0ws","Rilès","THANK GOD","Republic Records",53,101,42,"27363"
100,"spotify:track:6p2bt2xM6mf25q3wAmI5kd","Damso","Μ. Noob Saibot","Universal Music Division Carthage Music",14,97,39,"27358"
101,"spotify:track:0PEvNecmiHz8PsegFXXmcF","Damso","Ξ. Une âme pour deux","Universal Music Division Carthage Music",15,95,39,"27115"
102,"spotify:track:3nd9UtBDugmxTwhSOzJE8K","Mister V","Petit déjeuner","Hey Pelo Records",4,99,18,"27043"
103,"spotify:track:5Ohxk2dO5COHF1krpoPigN","Harry Styles","Sign of the Times","Columbia",28,124,60,"26863"
104,"spotify:track:3Ytr1SUCUi6J3L9dRFx5iH","Major Lazer, Travis Scott, Camila Cabello, Quavo","Know No Better (feat. Travis Scott, Camila Cabello & Quavo)","Third Pardee Records",93,115,4,"26654"
105,"spotify:track:6D8tdYo3mBOIUrWAk8wOVo","Alonzo, MHD","Feu d'artifice","Universal Music Division Island Def Jam",44,100,81,"26298"
106,"spotify:track:4kKJ5CjwCtksszPMntho4N","Nekfeu","Mauvaise graine","Universal Music Division Carthage Music",1,106,156,"26248"
107,"spotify:track:6EpRaXYhGOB3fj4V2uDkMJ","Liam Payne, Quavo","Strip That Down (feat. Quavo)","Capitol Records UK / EMI",107,132,15,"26034"
108,"spotify:track:28co1mTCrGIGOeGzqLjSat","Lacrim","Grande armée","Universal Music Division Capitol Music France",2,102,109,"25965"
109,"spotify:track:5Ik150YpJw117EFg5gF9lP","Naps","À part ça","Duetti",101,104,20,"25555"
110,"spotify:track:0P8n6AIBVc88gxbliu0lej","Mister V, Juice","Apollo13","Hey Pelo Records",9,105,18,"25543"
111,"spotify:track:2eMwDehkIC1j68U6FA3Eiq","Lil Uzi Vert","XO Tour Llif3","Generation Now/Atlantic",111,114,41,"25417"
112,"spotify:track:0lkQfsTMmtDA37tjjew9n0","PNL","Naha","QLF Records",22,108,156,"25142"
113,"spotify:track:2Vd1vVQaBilW0O6nmU5BkH","Vianney","Je m'en vais","Tôt Ou Tard",2,110,156,"25047"
114,"spotify:track:63z6p4gpgnpZprANkpBIHH","Dosseh, Booba","Infréquentables","Universal Music Division Capitol Music France",18,109,156,"24911"
115,"spotify:track:63qapUS8yLKz0tb0eOgOTF","Loïc Nottet","Million Eyes","Jive Epic",12,113,149,"24897"
116,"spotify:track:6ymKsfbFtQ12mmPJxPAamb","SCH","Poupée russe","Universal Music Division Capitol Music France",14,117,46,"24428"
117,"spotify:track:6HViP4DVYa8gQtxLndmhwu","Møme, Merryn Jeann","Aloha","Universal Music Division Virgin Records",20,89,156,"24328"
118,"spotify:track:6x8j5V85ZJHtvOSjSamcVc","MHD","Afro Trap Pt. 7 (La puissance)","Universal Music Division Capitol Music France",3,103,156,"24310"
119,"spotify:track:2r0ECFc7nWPdRosmgo84pl","Mister V","Venice","Hey Pelo Records",7,112,18,"24254"
120,"spotify:track:5YIbA6i8pPUnl6CDpVDa63","Dadju","Reine","Universal Music Division Capitol Music France",101,122,30,"24215"
121,"spotify:track:0fg8CqpjdojMyXLNzM2PaJ","Major Lazer, PARTYNEXTDOOR, Nicki Minaj","Run Up","Third Pardee Records",12,121,130,"24072"
122,"spotify:track:58zsLZPvfflaiIbNWoA22O","Rag'n'Bone Man","Human","Best Laid Plans/Columbia",5,120,156,"23831"
123,"spotify:track:2habSXqcJGExM6JJyskY7O","Miley Cyrus","Malibu","RCA Records Label",86,146,25,"23820"
124,"spotify:track:4pdPtRcBmOSQDlJ3Fk945m","DJ Snake, Justin Bieber","Let Me Love You","DJ Snake Def Jam",7,131,156,"23195"
125,"spotify:track:5t9fmZx0pcNxLykKTv6eOe","Nekfeu, Sneazzy, S.Pri Noir","Saturne","Universal Music Division Carthage Music",5,128,156,"23057"
126,"spotify:track:7abpmGpF7PGep2rDU68GBR","Burak Yeter, Danelle Sandoval","Tuesday","SBA Production",7,119,156,"22613"
127,"spotify:track:6HUnnBwYZqcED1eQztxMBN","Martin Jensen","Solo Dance","Intercord",109,149,114,"22606"
128,"spotify:track:6QUDs5wTqWwI4Ed68GLdlC","Ninho","Roro","Rec. 118 / Mal Luné Music",67,123,46,"22467"
129,"spotify:track:1NAeorrSNCibpdJMpXLFeG","Ødyssey, Amara Abonta","Fly","Kalyna Music",111,164,17,"22195"
130,"spotify:track:4Hg1iEa7zg4Z0l2oxpARIL","Naps","Ciao","Duetti",123,133,17,"22153"
131,"spotify:track:2cMupQ1HCvkbSk2nNSRlXw","Kalash Criminel, KeBlack","Mélanger","Universal Music Division Capitol Music France",89,125,21,"22145"
132,"spotify:track:3ksnrZfyto1Ill9E3oDHnh","Sofiane","Marion Maréchal","Universal Music Division Capitol Music France",18,153,25,"22118"
133,"spotify:track:0y1QJc3SJVPKJ1OvFmFqe6","KALEO","Way down We Go","Elektra (NEK)",12,140,146,"22075"
134,"spotify:track:0NUvPSk4VzBW0ClqgGxNRj","Vald, Damso","Vitrine","Universal Music Division Capitol Music France",29,127,127,"21959"
135,"spotify:track:5nQHYFZC2mcUF1ouFBPsz1","Scridge","Pour walou","Snafu Records",125,136,41,"21942"
136,"spotify:track:6wR97bho2QoIiP5wxNxtQz","Djadja & Dinaz","C'est la même","Carré-Music",25,130,86,"21873"
137,"spotify:track:0ban5QRXUveaKtQPGuaoQ9","Kaaris","Tchoin","Universal Music Division Virgin Records",2,118,156,"21715"
138,"spotify:track:6paaJeUuEGW5QzOAegwuAr","Rilès","I Do It","RILÈSUNDAYZ",52,141,42,"21643"
139,"spotify:track:4GsZNxO5EqEIrmfcFZ5lrH","Kalash Criminel","Enterrez-les","Universal Music Division Capitol Music France",81,129,43,"21558"
140,"spotify:track:6HZILIRieu8S0iqY8kIKhj","Kendrick Lamar","DNA.","Aftermath",6,138,53,"21314"
141,"spotify:track:1wlENIsHNc9Iz4K1pFKgOT","DTF, N.O.S","Avant de partir","QLF Records",67,144,18,"21228"
142,"spotify:track:5PUZLLiQzxBg6TijpzU3dH","Mister V, Samy Ceezy","Deutsche Qualität","Hey Pelo Records",8,135,18,"21189"
143,"spotify:track:7i2DJ88J7jQ8K7zqFX2fW8","Halsey","Now Or Never","Astralwerks (ASW)",143,161,20,"21149"
144,"spotify:track:2qQ9rKLbylbmmmR9RUSdWI","Hornet La Frappe","Double H","MyMedia Agency",100,142,59,"21083"
145,"spotify:track:2KiHXiqQA2dHiLfeSxtTeP","KeBlack","Bazardée","Mukongo Business",6,126,156,"21023"
146,"spotify:track:4J6xvZhJh26lmAEAXGDCKu","Naive New Beaters, Izïa","Heal Tomorrow","Universal Music Division Capitol Music France",28,174,151,"20914"
147,"spotify:track:5UOGzIMvxXyRZIWBbqDcpU","PNL","DA","QLF Records",58,139,156,"20749"
148,"spotify:track:6rUNjnRrlhCy7xGq6WpV4C","Greg June, Esmeralda","How Many Times (feat. Esmeralda)","Jo & Co",144,147,8,"20743"
149,"spotify:track:5NZpY9WeWFtlHVgepfCamX","PNL","Dans la légende","QLF Records",45,143,156,"20685"
150,"spotify:track:17Fd6Yb7mSbinKG8LoWfFl","Mike Posner, Seeb","I Took A Pill In Ibiza - Seeb Remix","Monster Mountain, LLC / Island",18,151,156,"20362"
151,"spotify:track:1sCxVKWImDZSZKvG0U9B23","Selena Gomez","Bad Liar","Selena Gomez PS",51,176,19,"19798"
152,"spotify:track:6mICuAdrwEjh6Y6lroV2Kg","Shakira, Maluma","Chantaje (feat. Maluma)","Sony Music Latin",13,148,155,"19672"
153,"spotify:track:11hj8c8BCRd5ND3CRhZSvt","Nekfeu","Squa","Universal Music Division Carthage Music",2,159,156,"19272"
154,"spotify:track:27SdWb2rFzO6GWiYDBTD9j","Sia","Cheap Thrills","Monkey Puzzle Records/RCA Records",27,137,156,"19245"
155,"spotify:track:0qYTZCo5Bwh1nsUFGZP3zn","Maluma","Felices los 4","Sony Music Latin",145,145,9,"19051"
156,"spotify:track:5B13mNIiknPY2zKCyn1O6L","S.Pri Noir","Skywalker","Believe Recordings",124,166,49,"18981"
157,"spotify:track:2pA1oug5Xo7BLEkWSAsO0X","Sofiane, Hornet La Frappe, GLK, YL","Le cercle","Universal Music Division Capitol Music France",34,178,25,"18968"
158,"spotify:track:0u6HzAVFUBiKslzPF9G9vd","Ninho","Dis-moi que tu m'aimes","Rec. 118 / Mal Luné Music",66,158,156,"18944"
159,"spotify:track:2sOrroHqKbYFP2MfHxhQMc","Rim'K","Cellophané","MB",51,156,156,"18918"
160,"spotify:track:3AbR9rS5iPPPG5F5TJtLMs","Sadek, Brulux","La Bise (feat. Brulux)","Rec. 118 / Industreet",59,165,153,"18686"
161,"spotify:track:65mBlk8cyhVpe1OUhLShhp","Naps","Vroum vroum","Duetti",152,160,17,"18629"
162,"spotify:track:5uCax9HTNlzGybIStD3vDh","James Arthur","Say You Won't Let Go","Columbia",12,193,151,"18616"
163,"spotify:track:3LVYyIwOw16nmkzvLK7mAF","Mister V, Tortoz","Gville","Hey Pelo Records",12,154,18,"18530"
164,"spotify:track:2hgzdQdnfWwtdpZbhZlV72","Jennifer Lopez","Ain't Your Mama","Epic/Nuyorican Productions",33,134,95,"18414"
165,"spotify:track:4S1ZmpEshXG3S0OLdodb1W","Sneazzy, Nekfeu","Skurt Cobain","Believe Recordings",86,179,150,"18374"
166,"spotify:track:4Km5HrUvYTaSUfiSGPJeQR","Migos, Lil Uzi Vert","Bad and Boujee (feat. Lil Uzi Vert)","Quality Control Music",56,163,155,"18238"
167,"spotify:track:2Z8WuEywRWYTKe1NybPQEW","Twenty One Pilots","Ride","Fueled By Ramen",19,194,152,"18228"
168,"spotify:track:7bJwvubZZaoGE1AGEfu8Fi","Ariana Grande","One Last Time","Universal Records",168,-1,1,"18216"
169,"spotify:track:0X6496L5nTxkASOzNj8VYJ","Mister V","Demain","Hey Pelo Records",10,175,18,"18170"
170,"spotify:track:3VvXGTB7qzTJ0nBOBwiH9X","Sadek","Dans la lune","Rec. 118 / Industreet",152,167,18,"18160"
171,"spotify:track:0L7loeTIg6akW84aEQZpCT","Major Lazer, Nyla, Fuse ODG","Light It Up","Third Pardee Records",45,180,140,"18150"
172,"spotify:track:7gXWIxX7rUtKGNtRkot8p3","RIDSA","Mamamia","Wagram Music / W Lab",157,157,5,"18130"
173,"spotify:track:2jBleFNl3YK8lyJc1OvxXt","PNL","Jusqu'au dernier gramme","QLF Records",69,173,146,"18048"
174,"spotify:track:1b0loCDMFC8WqvUtmELtYm","Alonzo","J’écris","Universal Music Division Island Def Jam",87,181,39,"18030"
175,"spotify:track:1iDQ2zCOU1uYeR8QcpqUZb","Booba","DKR - Bonus Track","Universal Music Distribution Deal",14,169,156,"17999"
176,"spotify:track:1vvNmPOiUuyCbgWmtc6yfm","Calvin Harris","My Way","Columbia",4,170,155,"17904"
177,"spotify:track:7LELmSLARiSAoIKVsVoH2F","Mister V","Bulletproof","Hey Pelo Records",18,177,18,"17758"
178,"spotify:track:6t0YWXFvlbx0Blh7FuyCje","Naps, 13ème Art","Elle t'a piqué","Duetti",152,184,17,"17556"
179,"spotify:track:6De0lHrwBfPfrhorm9q1Xl","Danny Ocean","Me Rehúso","Atlantic Records",152,152,4,"17475"
180,"spotify:track:52CccjQSCEzwh6TG36OBRK","GIMS","Marabout","Chahawat",94,198,25,"17415"
181,"spotify:track:6FK7DCwcQWWWG9VAT6ZGvz","Boostee","Pop Corn","Universal Music Division Label Panthéon",17,196,156,"17345"
182,"spotify:track:4WjH9Bzt3kx7z8kl0awxh4","Major Lazer, MØ, DJ Snake","Lean On (feat. MØ & DJ Snake)","Third Pardee Records",66,172,105,"17335"
183,"spotify:track:3ltgJH3QyXssSktzngCsHM","DTF","Comme un fou","QLF Records",117,192,17,"17267"
184,"spotify:track:0tICYNayWWhH9GPeFrfjfD","Kungs, Cookin' On 3 Burners","This Girl (Kungs Vs. Cookin' On 3 Burners)","Universal Music Division Polydor France",80,171,148,"17191"
185,"spotify:track:6gmsmnjT3ojmm7apL8UD8M","SCH","J'attends","Universal Music Division Capitol Music France",24,188,53,"17162"
186,"spotify:track:6QfPyKRfSQBb3ccajHioEm","L'Algérino","Les menottes (Tching Tchang Tchong)","Black Pearl Music",186,187,5,"17144"
187,"spotify:track:6NOBQsQ2TsAK8ieuFEB0O6","Lacrim","Traîtres","Universal Music Division Capitol Music France",1,190,122,"17057"
188,"spotify:track:0XIzUm7rwQfyy6H1CJeAs9","Damso","BruxellesVie","Universal Music Division Carthage Music",144,195,18,"16955"
189,"spotify:track:1OYlOIc7UdRBe1daHclsRU","Bigflo & Oli","Personne","Universal Music Division Virgin Records",162,191,3,"16907"
190,"spotify:track:1SJtlNRJDeYHioymcvsqev","Camila Cabello","Crying in the Club","Syco Music/Epic",190,-1,6,"16864"
191,"spotify:track:4nNqcuufJv09PS4AM5RcO4","Mister V","Thérapie","Hey Pelo Records",17,189,18,"16796"
192,"spotify:track:5tz69p7tJuGPeMGwNTxYuV","Logic, Alessia Cara, Khalid","1-800-273-8255","Def Jam Recordings",174,-1,12,"16754"
193,"spotify:track:25VUrDOMnM5j3FHxfJrB9p","SCH","Nino Brown","Universal Music Division Capitol Music France",8,200,31,"16528"
194,"spotify:track:3zLMWD22TUiKZ3L6FPjiCL","Sadek, Gradur","Andale (feat. Gradur)","Rec. 118 / Industreet",70,199,148,"16424"
195,"spotify:track:5aAx2yezTd8zXrkmtKl66Z","The Weeknd, Daft Punk","Starboy","The Weeknd/Lyric",2,-1,151,"16332"
196,"spotify:track:4c3I4JPNYHQvgG55mvVECj","Lartiste","Clandestina","Purple Money / Zayn Corporation",117,150,111,"16241"
197,"spotify:track:5c0aiERRxHjbvu5tQ9jwAE","Dagny","Wearing Nothing","Universal Records",197,-1,2,"16208"
198,"spotify:track:5zCO1EU3KpM2tsFaZdu9vq","Kaaris","Boyz N The Hood","Universal Music Division Virgin Records",83,-1,96,"16179"
199,"spotify:track:1louJpMmzEicAn7lzDalPW","Cheat Codes, Demi Lovato","No Promises (feat. Demi Lovato)","Parlophone UK",165,-1,6,"16083"
200,"spotify:track:0sqOIwjQoaiEXcSgl8iqsi","Gradur, MHD, Alonzo, Nyda","Oblah","Universal Music Division Capitol Music France",42,197,149,"16060"
