rank,uri,artist_names,track_name,source,peak_rank,previous_rank,days_on_chart,streams,lastfm_tags,pop_flag,album,release_date,days_since_release
1,spotify:track:53iuhJlwXhSER5J2IYYv1W,Taylor Swift,The Fate of Ophelia,Taylor Swift,1,1,43,7679759,pop; best of 2025; baroque pop; synthpop; love at first listen,True,The Life of a Showgirl,,
7,spotify:track:3yWuTOYDztXjZxdE2cIRUa,Taylor Swift,Opalite,Taylor Swift,2,6,43,3826643,pop; synthpop; soft rock; rnb; christmas,True,The Life of a Showgirl,,
55,spotify:track:1jgTiNob5cVyXeJ3WgX5bL,Taylor Swift,Elizabeth Taylor,Taylor Swift,2,55,43,1874992,who put katy perry?; pop; baroque pop; soty; halsey,True,The Life of a Showgirl,,
80,spotify:track:03bTIHJElXZ0O0jqOQvAbY,Taylor Swift,Father Figure,Taylor Swift,4,76,43,1683092,soty; best of 2025; synthpop; pop; female vocalist,True,The Life of a Showgirl,,
109,spotify:track:5eXgqtg3T8Av0m1FUaGHex,"Taylor Swift, Sabrina Carpenter",The Life of a Showgirl (feat. Sabrina Carpenter),Taylor Swift,6,108,43,1526336,pop; power pop; rnb; disco; acid rock,True,,,
133,spotify:track:2TEQvxxQabwLQMqWMg1qGu,Taylor Swift,Wi$h Li$t,Taylor Swift,7,115,43,1441323,pop; synthpop; fav; synth pop; dream,True,The Life of a Showgirl,,
190,spotify:track:5ylJtmaWPJ33cW3En7WOu0,Taylor Swift,Wood,Taylor Swift,5,175,43,1289135,pop; funk; disco; sexy; 70s,True,The Life of a Showgirl,,
