rank,uri,artist_names,track_name,source,peak_rank,previous_rank,days_on_chart,streams,lastfm_tags,album,release_date,days_since_release
21,spotify:track:1BxfuPKGuaTgP7aM0Bbdwr,Taylor Swift,Cruel Summer,Taylor Swift,2,23,562,2966720,electropop; pop; synthpop; industrial pop; synthwave,Lover,,
40,spotify:track:2OzhQlSqBEmt7hmkYxfT6m,"Taylor Swift, Post Malone",Fortnight (feat. Post Malone),Taylor Swift,1,42,124,2260022,pop; best of 2024; soty; synthpop; singer-songwriter,The Tortured Poets Department (Webstore Exclusive),,
57,spotify:track:3hUxzQpSfdDqwM3ZTFQY0K,Taylor Swift,august,Taylor Swift,4,64,451,1987235,dream pop; folk; folk pop; indie pop; indie,folklore: the long pond studio sessions (from the Disney+ special),,
94,spotify:track:4q5YezDOIPcoLr8R81x9qy,Taylor Swift,I Can Do It With a Broken Heart,Taylor Swift,3,98,124,1693980,pop; best of 2024; synthpop; dance-pop; soty,THE TORTURED POETS DEPARTMENT,,
169,spotify:track:1dGr1c8CrMLDpV6mPbImSI,Taylor Swift,Lover,Taylor Swift,2,156,502,1355489,pop; country; love; indie folk; country pop,You Belong With Me,,
