rank,uri,artist_names,track_name,source,peak_rank,previous_rank,days_on_chart,streams,lastfm_tags,album,release_date,days_since_release
24,spotify:track:2OzhQlSqBEmt7hmkYxfT6m,"Taylor Swift, Post Malone",Fortnight (feat. Post Malone),Taylor Swift,1,21,72,3230757,pop; best of 2024; soty; synthpop; singer-songwriter,The Tortured Poets Department (Webstore Exclusive),,
25,spotify:track:1BxfuPKGuaTgP7aM0Bbdwr,Taylor Swift,Cruel Summer,Taylor Swift,2,24,510,3199741,electropop; pop; synthpop; industrial pop; synthwave,Lover,,
48,spotify:track:4q5YezDOIPcoLr8R81x9qy,Taylor Swift,I Can Do It With a Broken Heart,Taylor Swift,3,42,72,2192002,pop; best of 2024; synthpop; dance-pop; soty,THE TORTURED POETS DEPARTMENT,,
118,spotify:track:0hhzNPE68LWLfgZwdpxVdR,"Gracie Abrams, Taylor Swift",us. (feat. Taylor Swift),"Gracie Abrams, under exclusive license to Interscope Records",25,85,9,1494476,taylor swift; my top songs; jennyeons; folk-pop; sufjan stevens,The Secret Of Us Deluxe (Japan Edition),,
159,spotify:track:0W0iAC1VGlB82PI6elxFYf,Taylor Swift,Guilty as Sin?,Taylor Swift,11,149,72,1367281,pop; best of 2024; singer-songwriter; pop rock; soty,THE TORTURED POETS DEPARTMENT,,
164,spotify:track:2F3N9tdombb64aW6VtZOdo,Taylor Swift,Down Bad,Taylor Swift,2,144,72,1352327,pop; synthpop; best of 2024; love at first listen; pop perfect,THE TORTURED POETS DEPARTMENT,,
