rank,uri,artist_names,track_name,source,peak_rank,previous_rank,days_on_chart,streams,lastfm_tags,album,release_date,days_since_release
16,spotify:track:2OzhQlSqBEmt7hmkYxfT6m,"Taylor Swift, Post Malone",Fortnight (feat. Post Malone),Taylor Swift,1,17,49,4322055,pop; best of 2024; soty; synthpop; singer-songwriter,The Tortured Poets Department (Webstore Exclusive),,
24,spotify:track:1BxfuPKGuaTgP7aM0Bbdwr,Taylor Swift,Cruel Summer,Taylor Swift,2,23,487,3216643,electropop; pop; synthpop; industrial pop; synthwave,Lover,,
32,spotify:track:4q5YezDOIPcoLr8R81x9qy,Taylor Swift,I Can Do It With a Broken Heart,Taylor Swift,3,32,49,2849679,pop; best of 2024; synthpop; dance-pop; soty,THE TORTURED POETS DEPARTMENT,,
60,spotify:track:2F3N9tdombb64aW6VtZOdo,Taylor Swift,Down Bad,Taylor Swift,2,63,49,2014857,pop; synthpop; best of 2024; love at first listen; pop perfect,THE TORTURED POETS DEPARTMENT,,
76,spotify:track:0W0iAC1VGlB82PI6elxFYf,Taylor Swift,Guilty as Sin?,Taylor Swift,11,73,49,1873089,pop; best of 2024; singer-songwriter; pop rock; soty,THE TORTURED POETS DEPARTMENT,,
92,spotify:track:36t6frENUtCYKuZus6aYDO,Taylor Swift,Who’s Afraid of Little Old Me?,Taylor Swift,9,88,49,1722566,love at first listen; pop; best of 2024; pop rock; taylor swift,THE TORTURED POETS DEPARTMENT [Clean] [Clean],,
127,spotify:track:3Vevii7qKqrmW8CcyzBHDl,Taylor Swift,"So Long, London",Taylor Swift,4,123,49,1522263,pop; best of 2024; singer-songwriter; synthpop; wsum 91.7 fm madison,THE TORTURED POETS DEPARTMENT,,
157,spotify:track:2XXwLdtuAcE0HSCu61ijAb,Taylor Swift,My Boy Only Breaks His Favorite Toys,Taylor Swift,5,149,49,1442544,pop; best of 2024; synthpop; female vocalists; taylor swift,THE TORTURED POETS DEPARTMENT,,
158,spotify:track:5og4Qzt92jJzVDkOtSEilb,Taylor Swift,But Daddy I Love Him,Taylor Swift,6,155,49,1437739,pop; best of 2024; pop rock; colleen hoover; country,THE TORTURED POETS DEPARTMENT,,
