rank,uri,artist_names,track_name,source,peak_rank,previous_rank,days_on_chart,streams,lastfm_tags,pop_flag,album,release_date,days_since_release
1,spotify:track:53iuhJlwXhSER5J2IYYv1W,Taylor Swift,The Fate of Ophelia,Taylor Swift,1,1,55,7183182,pop; best of 2025; baroque pop; synthpop; love at first listen,True,The Life of a Showgirl,,
10,spotify:track:3yWuTOYDztXjZxdE2cIRUa,Taylor Swift,Opalite,Taylor Swift,2,9,55,3308386,pop; synthpop; soft rock; rnb; christmas,True,The Life of a Showgirl,,
106,spotify:track:1jgTiNob5cVyXeJ3WgX5bL,Taylor Swift,Elizabeth Taylor,Taylor Swift,2,108,55,1462897,who put katy perry?; pop; baroque pop; soty; halsey,True,The Life of a Showgirl,,
140,spotify:track:03bTIHJElXZ0O0jqOQvAbY,Taylor Swift,Father Figure,Taylor Swift,4,158,55,1330577,soty; best of 2025; synthpop; pop; female vocalist,True,The Life of a Showgirl,,
181,spotify:track:5eXgqtg3T8Av0m1FUaGHex,"Taylor Swift, Sabrina Carpenter",The Life of a Showgirl (feat. Sabrina Carpenter),Taylor Swift,6,190,50,1216929,pop; power pop; rnb; disco; acid rock,True,,,
186,spotify:track:2TEQvxxQabwLQMqWMg1qGu,Taylor Swift,Wi$h Li$t,Taylor Swift,7,192,51,1205394,pop; synthpop; fav; synth pop; dream,True,The Life of a Showgirl,,
