rank,uri,artist_names,track_name,source,peak_rank,previous_rank,days_on_chart,streams,lastfm_tags,album,release_date,days_since_release
15,spotify:track:1BxfuPKGuaTgP7aM0Bbdwr,Taylor Swift,Cruel Summer,Taylor Swift,2,11,418,4004346,electropop; pop; synthpop; industrial pop; synthwave,Lover,,
112,spotify:track:1dGr1c8CrMLDpV6mPbImSI,Taylor Swift,Lover,Taylor Swift,2,85,428,1610587,pop; country; love; indie folk; country pop,You Belong With Me,,
120,spotify:track:0V3wPSX9ygBnCm8psDIegu,Taylor Swift,Anti-Hero,Taylor Swift,1,91,524,1536795,rock; grunge; 90s; test-tag; batch-test,Midnights [Clean],,
145,spotify:track:4R2kfaDFhslZEMJqAFNpdd,Taylor Swift,cardigan,Taylor Swift,1,112,479,1435774,folk pop; folk; chamber pop; singer-songwriter; indie,Now That's What I Call Music! Vol. 76,,
189,spotify:track:1R0a2iXumgCiFb7HEZ7gUE,Taylor Swift,Don’t Blame Me,Taylor Swift,68,174,590,1248069,pop; electropop; gospel; edm; exile,Golden Collection,,
