rank,uri,artist_names,track_name,source,peak_rank,previous_rank,days_on_chart,streams
1,"spotify:track:2Pu2Kcm1cwFg4dDSdmFip4","Niska","Réseaux","Universal Music Division Capitol Music France",1,1,14,"203416"
2,"spotify:track:2UZW9WOPXdxw9YMG1bebS8","Damso","Θ. Macarena","Universal Music Division Carthage Music",1,2,84,"151099"
3,"spotify:track:1OAh8uOEOvTDqkKFsKksCi","DJ Khaled, Rihanna, Bryson Tiller","Wild Thoughts (feat. Rihanna & Bryson Tiller)","Epic/We The Best",1,3,35,"111197"
4,"spotify:track:5bcTCxgc7xVfSaMV3RuVke","Calvin Harris, Pharrell Williams, Katy Perry, Big Sean, Funk Wav","Feels (feat. Pharrell Williams, Katy Perry & Big Sean)","Columbia",4,5,35,"110345"
5,"spotify:track:7qiZfU4dY1lWllzX7mPBI3","Ed Sheeran","Shape of You","Atlantic Records UK",1,4,196,"108977"
6,"spotify:track:08GhiNwYij4HNVkBZnJvft","Ninho","Mamacita","Rec. 118 / Mal Luné Music",6,6,15,"104695"
7,"spotify:track:3B54sVLJ402zGa6Xm4YGNe","French Montana, Swae Lee","Unforgettable","Bad Boy Entertainment/Epic Records",4,7,95,"103335"
8,"spotify:track:5CtI0qwDJkDQGwXD1H1cLb","Luis Fonsi, Daddy Yankee, Justin Bieber","Despacito - Remix","UMLE - Latino",2,8,94,"102742"
9,"spotify:track:3DXncPQOG4VBw3QHh3S817","DJ Khaled, Justin Bieber, Quavo, Chance the Rapper, Lil Wayne","I'm the One (feat. Justin Bieber, Quavo, Chance the Rapper & Lil Wayne)","Epic/We The Best",4,9,84,"91938"
10,"spotify:track:4aWmUDTfIPGksMNLV2rQP2","Luis Fonsi, Daddy Yankee","Despacito","UMLE - Latino",2,12,179,"91248"
12,"spotify:track:4iLqG9SeJSnt0cSPICSjxv","Charlie Puth","Attention","Artist Partner",4,10,90,"87062"
13,"spotify:track:6kex4EBAj0WHXDKZMEJaaF","Jason Derulo, Nicki Minaj, Ty Dolla $ign","Swalla (feat. Nicki Minaj & Ty Dolla $ign)","Beluga Heights/Warner Records",6,15,117,"83889"
14,"spotify:track:4fwtP5khM1iEoa6BP1QQsX","Lartiste, Awa Imani","Chocolat (feat. Awa Imani)","Purple Money / Zayn Corporation",4,14,165,"82554"
15,"spotify:track:49qQQcd8wONsOy3PwnZKHB","Jul","Ma jolie","D'Or et de Platine",5,13,21,"81382"
16,"spotify:track:03aduXwm6cTqO9bb4XFQ2b","Damso","Ε. Signaler","Universal Music Division Carthage Music",5,16,84,"78195"
17,"spotify:track:2rb5MvYT7ZIxbKW5hfcHx8","J Balvin, Willy William","Mi Gente","Scorpio Music (FR)",17,21,17,"77182"
18,"spotify:track:2jBleFNl3YK8lyJc1OvxXt","PNL","Jusqu'au dernier gramme","QLF Records",14,17,186,"76041"
19,"spotify:track:1NAeorrSNCibpdJMpXLFeG","Ødyssey, Amara Abonta","Fly","Kalyna Music",10,19,62,"75009"
20,"spotify:track:3rOSwuTsUlJp0Pu0MkN8r8","Future","Mask Off","Epic/Freebandz/A1",2,18,148,"74480"
21,"spotify:track:1x5sYLZiu9r5E43kMlt9f8","Clean Bandit, Zara Larsson","Symphony (feat. Zara Larsson)","Atlantic Records UK",7,20,121,"73984"
22,"spotify:track:3ACvYZqgoP36dURFeovOR8","Booba","Nougat","Universal Music Distribution Deal",1,22,14,"71336"
23,"spotify:track:0NiXXAI876aGImAd6rTj8w","Jonas Blue, William Singe","Mama","UMOD (Universal Music On Demand)",12,23,54,"71051"
24,"spotify:track:0tKcYR2II1VCQWT79i5NrW","Imagine Dragons","Thunder","Kid Ina Korner / Interscope",15,25,72,"70835"
25,"spotify:track:0CcQNd8CINkwQfe1RDtGV6","Imagine Dragons","Believer","Kid Ina Korner / Interscope",11,24,162,"70556"
26,"spotify:track:7nKBxz47S9SD79N086fuhn","Enrique Iglesias, Descemer Bueno, Zion & Lennox","SUBEME LA RADIO","RCA Records/Sony Music International/Sony Music Latin",11,26,124,"69949"
27,"spotify:track:0dA2Mk56wEzDgegdC6R17g","Zedd, Alessia Cara","Stay","UMGRI Interscope",15,28,145,"65063"
28,"spotify:track:7tr2za8SQg2CI8EDgrdtNl","Calvin Harris, Frank Ocean, Migos, Funk Wav","Slide (feat. Frank Ocean & Migos)","Columbia",17,27,147,"63255"
29,"spotify:track:1E3zyoTHtJzsu5CjwIFIhY","Damso","Γ. Mosaïque solitaire","Universal Music Division Carthage Music",3,29,84,"61479"
30,"spotify:track:3Ytr1SUCUi6J3L9dRFx5iH","Major Lazer, Travis Scott, Camila Cabello, Quavo","Know No Better (feat. Travis Scott, Camila Cabello & Quavo)","Third Pardee Records",27,31,49,"59499"
31,"spotify:track:3HVr6jTVwBHBa2flM0eURR","Macklemore, Skylar Grey","Glorious (feat. Skylar Grey)","Bendo LLC",31,44,14,"59184"
32,"spotify:track:6RUKPb4LETWmmr3iAEQktW","The Chainsmokers, Coldplay","Something Just Like This","Disruptor Records/Columbia",6,30,148,"58813"
33,"spotify:track:78rIJddV4X0HkNAInEcYde","Starley, Ryan Riback","Call on Me - Ryan Riback Remix","Central Station Records",2,32,201,"56968"
35,"spotify:track:4q8PHoRsPUB52LFylX8Ulz","Axwell /\ Ingrosso, Axwell, Sebastian Ingrosso","More Than You Know","Pophouse Entertainment Group",29,38,33,"56491"
36,"spotify:track:2Gl0FzuLxflY6nPifJp5Dr","Kygo, Ellie Goulding","First Time","Kygo",23,39,82,"56347"
37,"spotify:track:2fgk04HR0nlgNysfX7fKF0","Lorenzo","Fume à fond","MFC",13,36,35,"56027"
38,"spotify:track:1NDxZ7cFAo481dtYWdrUnR","Maggie Lindemann, Cheat Codes, CADE","Pretty Girl - Cheat Codes X CADE Remix","300 Entertainment",17,35,66,"56000"
40,"spotify:track:5EnYT6F7wEcdege6mDHEfO","Drake","Signs","Cash Money Records/Young Money Ent./Universal Rec.",32,37,27,"55620"
41,"spotify:track:4HvYhaXDmmAW6ZmPcgPZca","Damso","B. #QuedusaalVie","Universal Music Division Carthage Music",2,34,84,"55224"
42,"spotify:track:79cuOz3SPQTuFrp8WgftAu","Shawn Mendes","There's Nothing Holdin' Me Back","Island Records",22,40,91,"54795"
43,"spotify:track:1sXUWdKx03aP9Gmzft58rt","Julia Michaels","Issues","J/Republic",21,45,159,"53815"
44,"spotify:track:6jA8HL9i4QGzsj6fjoxp8Y","Martin Garrix, Troye Sivan","There for You","Epic Amsterdam",23,41,56,"53529"
45,"spotify:track:0gn0krlJTSSZvnMxh2ITHY","Sofiane","Mon p'tit loup","Universal Music Division Capitol Music France",9,46,98,"52391"
46,"spotify:track:6Y6mUgZmUadVvfFuoGuy64","Niska","Chasse à l'homme","Universal Music Division Capitol Music France",42,42,84,"52056"
47,"spotify:track:57U26FwUclMqyZ5ylnPpw1","Damso","Α. Nwaar Is The New Black","Universal Music Division Carthage Music",1,43,86,"50791"
48,"spotify:track:4qknM1pQz53QOyfDVTjcM9","Shakira","Me Enamoré","Sony Music Latin",48,52,28,"50473"
49,"spotify:track:3bWAqKDWg6u1davspr5IkS","Robin Schulz, James Blunt","OK","WM Germany",29,48,39,"50193"
50,"spotify:track:7M16mAuWuFA5rC9HvkXaGx","Jax Jones, RAYE","You Don't Know Me (feat. RAYE)","Polydor Records",3,49,155,"49474"
51,"spotify:track:75UFzgBCaVwJJ4IVIaatpe","Damso","N. J Respect R","Universal Music Division Carthage Music",7,50,84,"49144"
52,"spotify:track:3VdDQkNCQKPAL4nZlFKWlN","Benash, Booba","Ghetto","Universal Music Division Capitol Music France",9,53,140,"45758"
53,"spotify:track:0afhq8XCExXpqazXczTSve","Ed Sheeran","Galway Girl","Atlantic Records UK",8,51,140,"45025"
54,"spotify:track:00X2yv2vrtritPt2CZnUTZ","PNL","Bené","QLF Records",3,57,201,"44343"
55,"spotify:track:3cFsmM51N5zMAuu1nNY4Tw","Sean Paul, Dua Lipa","No Lie","Universal-Island Records Ltd.",14,55,159,"44290"
56,"spotify:track:4GCIYE1x1TWJCChPkpy9by","PNL","Onizuka","QLF Records",10,58,201,"43766"
57,"spotify:track:6EpRaXYhGOB3fj4V2uDkMJ","Liam Payne, Quavo","Strip That Down (feat. Quavo)","Capitol Records UK / EMI",31,60,60,"43481"
58,"spotify:track:0z18wqbjuXTxzaNm4oegU2","Lacrim, Booba","Oh bah oui","Universal Music Division Capitol Music France",1,59,112,"43020"
59,"spotify:track:7B9TO9Syt0JoFJIQAqtTYJ","RIDSA","Avancer","Wagram Music / W Lab",53,61,30,"42066"
60,"spotify:track:6y2Kaz9QI01XBKJ8mTb7Pf","Rag'n'Bone Man","Skin","Best Laid Plans/Columbia",28,56,167,"41768"
61,"spotify:track:61WbtB6ujkpNAsAf5LjF4b","Katy Perry, Migos","Bon Appétit","Capitol Records (CAP)",27,66,73,"40321"
62,"spotify:track:00cbRAOr6wTPE9WBMejhiM","Mister V, Hayce Lemsi, Volts Face","Space Jam","Hey Pelo Records",2,63,63,"40277"
63,"spotify:track:3ebXMykcMXOcLeJ9xZ17XH","Martin Garrix, Dua Lipa","Scared to Be Lonely","Epic Amsterdam",7,65,175,"40173"
64,"spotify:track:7KXjTSCq5nL1LoYtL7XAwS","Kendrick Lamar","HUMBLE.","Aftermath",3,64,112,"39707"
65,"spotify:track:2KklXplRtxMsBYo474Es0w","Ofenbach","Be Mine","Elektra France",5,54,190,"39430"
66,"spotify:track:0U050yYuyc2Gq9hrfvfEq8","Hornet La Frappe","Gramme 2 peuf","Rec. 118 / Diez Peufra",28,62,153,"38806"
67,"spotify:track:5xhJmd0I15jFcEdqxfCzKk","The Chainsmokers, Louane","It Won't Kill Ya","Disruptor Records/Columbia",24,70,105,"38613"
68,"spotify:track:6QfPyKRfSQBb3ccajHioEm","L'Algérino","Les menottes (Tching Tchang Tchong)","Black Pearl Music",63,67,50,"38406"
69,"spotify:track:4ysXJQqi5zH0yz1R4sna52","Niska","B.O.C","Universal Music Division Capitol Music France",33,68,133,"37373"
70,"spotify:track:1jR1IgIku9uMN065DLrhlz","MHD","Bravo","Universal Music Division Capitol Music France",35,69,35,"37233"
71,"spotify:track:4c2W3VKsOFoIg2SFaO6DY5","Rita Ora","Your Song","Atlantic Records UK",52,74,49,"36356"
72,"spotify:track:5axLlrd4jZZs0eAKIeNtOX","Sadek, Niska","En leuleu (feat. Niska)","Rec. 118 / Industreet",69,72,15,"36316"
73,"spotify:track:0FuTx2s3YH1ppmtiM6l0zI","JP Cooper","September Song","Universal-Island Records Ltd.",50,77,161,"35653"
74,"spotify:track:6xcXAVbDuVT1pCsa2rmDHY","Siboy, Benash, Damso","Mobali","Universal Music Division Capitol Music France",57,71,21,"35175"
75,"spotify:track:1YcY5Iiv3Ab68QC2rMKuBP","Niska","J'suis dans l'baye","Universal Music Division Capitol Music France",73,73,105,"35102"
76,"spotify:track:376JSYpMMIJteMBozHUix0","Jul","Je ne me vois pas briller","D'Or et de Platine",29,75,65,"34814"
77,"spotify:track:3VvXGTB7qzTJ0nBOBwiH9X","Sadek","Dans la lune","Rec. 118 / Industreet",73,76,63,"34578"
78,"spotify:track:1VuThr0P0HnW0RQLgBRWhi","MHD","Afro Trap Pt. 9 (Faut les wet)","Universal Music Division Capitol Music France",62,81,7,"34089"
79,"spotify:track:2eMwDehkIC1j68U6FA3Eiq","Lil Uzi Vert","XO Tour Llif3","Generation Now/Atlantic",71,82,86,"33953"
80,"spotify:track:4JIOC5P1G1NjhRJ2JSXm41","Dabs","Ouloulou","Colored Music",56,84,175,"33706"
81,"spotify:track:4E5h59QIoN0vhfeEPMFTZw","Bigflo & Oli","Alors alors","Universal Music Division Virgin Records",51,80,34,"33570"
82,"spotify:track:6q7v7QdUgFqHLnmkc4XI5b","Alonzo","Bagarre","Universal Music Division Island Def Jam",76,78,21,"33509"
83,"spotify:track:3yHdlt7YQI9ItRTZU8HbgL","Timal","Vatos","Elektra France",83,86,2,"33391"
84,"spotify:track:5zCO1EU3KpM2tsFaZdu9vq","Kaaris","Boyz N The Hood","Universal Music Division Virgin Records",79,79,139,"33355"
85,"spotify:track:5FRCTmIl1SIie075FoVsqA","Kalash Criminel, Jul","Je ne comprends pas","Universal Music Division Capitol Music France",48,83,63,"32440"
86,"spotify:track:2QXNsj3HmqbDqbw0R9F5zo","Sofiane","Toka","Universal Music Division Capitol Music France",14,91,98,"32220"
87,"spotify:track:4rrzxq356QDANDVd0SB1Dq","Mister V","Top album","Hey Pelo Records",3,90,83,"31844"
88,"spotify:track:5urhEtesorARjZhjSaFntn","Damso","Ζ. Kietu","Universal Music Division Carthage Music",6,85,84,"31795"
89,"spotify:track:6nGSXuZrE5P7gSvtJs4unC","Damso","Κ. Kin la belle","Universal Music Division Carthage Music",12,88,84,"31634"
90,"spotify:track:0lkQfsTMmtDA37tjjew9n0","PNL","Naha","QLF Records",22,89,201,"31581"
91,"spotify:track:29rRQITL0TE9bcoi66i2O5","Lacrim, GIMS","Ce soir ne sors pas","Universal Music Division Capitol Music France",58,87,14,"31271"
92,"spotify:track:5ZXmCqIzh9cRaMMfdtHuyZ","Andrelli","Old Man","Firefly Entertainment",71,94,36,"30857"
93,"spotify:track:0hNduWmlWmEmuwEFcYvRu1","Petit Biscuit","Sunset Lover","Petit Biscuit",2,93,201,"30145"
94,"spotify:track:5GXAXm5YOmYT0kL5jHvYBt","The Weeknd, Daft Punk","I Feel It Coming","The Weeknd/Lyric",6,92,201,"29990"
95,"spotify:track:1i03F8e3iYugaWN1r1QCbU","Niro","Sors de ma tête","Universal Music Division Capitol Music France",79,98,14,"29762"
96,"spotify:track:6ATkHaUrIJUtwyhoGMmQgw","Damso","Δ. Dieu ne ment jamais","Universal Music Division Carthage Music",6,95,84,"28769"
97,"spotify:track:337NxxJAxClIStxYcu7HNG","Naps, 13ème Art, Graya, Kalif, Raisse, YL, Dika","Pochon bleu","Duetti",76,96,75,"28655"
98,"spotify:track:0UXW6ihyeYHfb4jae7QxGl","DTF","100 rêves","QLF Records",57,100,74,"28038"
99,"spotify:track:1Eck97uRMlprKOOJN9oO1E","G-Eazy, Kehlani","Good Life (with G-Eazy & Kehlani)","Artist Partner",46,102,101,"27902"
100,"spotify:track:1xznGGDReH1oQq0xzbwXa3","Drake, Wizkid, Kyla","One Dance","Cash Money Records/Young Money Ent./Universal Rec.",1,97,201,"27890"
101,"spotify:track:2KkD7TsSOHyG8sXdhLkTf8","SCH","MAC 11","Universal Music Division Capitol Music France",16,104,54,"27784"
102,"spotify:track:0lMbuWUpfTWhEmOKxppEau","Calvin Harris, Future, Khalid, Funk Wav","Rollin (feat. Future & Khalid)","Columbia",44,99,66,"27556"
103,"spotify:track:7syABtsvHvD3nO7OG91Ani","Sofiane","Tout l'monde s'en fout","Suther Kane",3,103,175,"27502"
104,"spotify:track:5UOGzIMvxXyRZIWBbqDcpU","PNL","DA","QLF Records",58,107,201,"27128"
105,"spotify:track:63z6p4gpgnpZprANkpBIHH","Dosseh, Booba","Infréquentables","Universal Music Division Capitol Music France",18,109,201,"26759"
106,"spotify:track:5Ik150YpJw117EFg5gF9lP","Naps","À part ça","Duetti",69,106,65,"26645"
107,"spotify:track:5YIbA6i8pPUnl6CDpVDa63","Dadju","Reine","Universal Music Division Capitol Music France",98,110,75,"26280"
108,"spotify:track:4Hg1iEa7zg4Z0l2oxpARIL","Naps","Ciao","Duetti",92,108,62,"26199"
109,"spotify:track:36giaa7roszmJh3okF5efv","Jul","C'est pas ma faute","D'Or et de Platine",46,105,21,"26177"
110,"spotify:track:6HViP4DVYa8gQtxLndmhwu","Møme, Merryn Jeann","Aloha","Universal Music Division Virgin Records",20,101,201,"25187"
111,"spotify:track:4myoVer3cPAUqBzDigYf7A","Damso","Λ. Lové","Universal Music Division Carthage Music",11,111,84,"25099"
112,"spotify:track:2hMBPbAkEC0wu6iylhdiaJ","DJ Sem, Marwa Loud","Mi Corazón","Universal Music Division Island Def Jam",112,113,8,"24822"
113,"spotify:track:25C5CowdsfXld2jJanbiex","Demi Lovato","Sorry Not Sorry","Island Records",113,140,7,"24649"
114,"spotify:track:450XNJRan5KMcpueK59gGo","BMYE, Naza, KeBlack, Youssoupha, Hiro, Jaymax, DJ Myst","Pourquoi chérie","Bomaye musik",111,115,23,"24554"
115,"spotify:track:3kxfsdsCpFgN412fpnW85Y","Childish Gambino","Redbone","Glassnote - VMG",114,114,44,"24527"
116,"spotify:track:1oXiNxPogfnfVMiqGdr2Pv","Jul, Kalash Criminel","Cagoulé","D'Or et de Platine",44,112,21,"24222"
117,"spotify:track:5NZpY9WeWFtlHVgepfCamX","PNL","Dans la légende","QLF Records",45,117,199,"24204"
118,"spotify:track:7dJqvusDNhwkkxb9UgKREN","Aya Nakamura","Comportement","Rec. 118",118,118,38,"24128"
119,"spotify:track:0qYTZCo5Bwh1nsUFGZP3zn","Maluma","Felices los 4","Sony Music Latin",118,122,53,"24114"
120,"spotify:track:1MUxJxub6ovS0rzTHRgyoF","MHD","Afro Trap Pt. 8 (Never)","Universal Music Division Capitol Music France",2,125,147,"23752"
121,"spotify:track:7A3rNO7cmVKM3boOmIBwtj","S.Pri Noir","Highlander","Believe Recordings",115,121,33,"23458"
123,"spotify:track:5knuzwU65gJK7IF5yJsuaW","Clean Bandit, Anne-Marie, Sean Paul","Rockabye (feat. Sean Paul & Anne-Marie)","Atlantic Records UK",2,116,201,"23261"
124,"spotify:track:60a0Rd6pjrkxjPbaKzXjfq","Linkin Park","In the End","Warner Records",124,-1,1,"23247"
125,"spotify:track:6HUnnBwYZqcED1eQztxMBN","Martin Jensen","Solo Dance","Intercord",109,119,159,"23160"
126,"spotify:track:5t9fmZx0pcNxLykKTv6eOe","Nekfeu, Sneazzy, S.Pri Noir","Saturne","Universal Music Division Carthage Music",5,127,201,"23087"
127,"spotify:track:4kKJ5CjwCtksszPMntho4N","Nekfeu","Mauvaise graine","Universal Music Division Carthage Music",1,133,201,"23062"
128,"spotify:track:2nLtzopw4rPReszdYBJU6h","Linkin Park","Numb","Warner Records",128,-1,1,"22936"
129,"spotify:track:1a5Yu5L18qNxVhXx38njON","Alok, Zeeba, Bruno Martini","Hear Me Now","Spinnin' Records",20,151,185,"22898"
130,"spotify:track:33dLYyEIRqEipCuLb8z1l0","Lacrim","La dolce vita","Universal Music Division Capitol Music France",6,123,112,"22782"
131,"spotify:track:6x8j5V85ZJHtvOSjSamcVc","MHD","Afro Trap Pt. 7 (La puissance)","Universal Music Division Capitol Music France",3,141,201,"22607"
132,"spotify:track:45KqDHTOJtIM53QR1gPGTa","Rilès","Brothers","RILÈSUNDAYZ",38,128,88,"22522"
133,"spotify:track:7gXWIxX7rUtKGNtRkot8p3","RIDSA","Mamamia","Wagram Music / W Lab",122,142,50,"22406"
134,"spotify:track:7FXXVMGfMLy1IkmgDIZJBp","Deen Burbigo, Nekfeu","Tu rêves","Universal Music Division Virgin Records",55,134,47,"22371"
135,"spotify:track:6De0lHrwBfPfrhorm9q1Xl","Danny Ocean","Me Rehúso","Atlantic Records",120,130,45,"22360"
136,"spotify:track:71gEIIqahWVslRCXtN5yhK","Djadja & Dinaz","Déstabilisé","Carré-Music",12,137,158,"22247"
137,"spotify:track:0NUvPSk4VzBW0ClqgGxNRj","Vald, Damso","Vitrine","Universal Music Division Capitol Music France",29,136,172,"22028"
138,"spotify:track:28co1mTCrGIGOeGzqLjSat","Lacrim","Grande armée","Universal Music Division Capitol Music France",2,135,154,"22005"
139,"spotify:track:4pdPtRcBmOSQDlJ3Fk945m","DJ Snake, Justin Bieber","Let Me Love You","DJ Snake Def Jam",7,126,201,"22005"
140,"spotify:track:6JMdhGfyz9C4kA4mTc6y9C","SCH","Comme si","Universal Music Division Capitol Music France",4,139,105,"21875"
141,"spotify:track:2bqexboOK1opJI8vjq3ISh","Jul","Beely","D'Or et de Platine",51,132,36,"21746"
142,"spotify:track:2Vd1vVQaBilW0O6nmU5BkH","Vianney","Je m'en vais","Tôt Ou Tard",2,138,201,"21655"
143,"spotify:track:5fOy1jT3t2l4wgNQHPwcMz","Bigflo & Oli","Personne","Universal Music Division Virgin Records",59,147,31,"21414"
144,"spotify:track:2Z8WuEywRWYTKe1NybPQEW","Twenty One Pilots","Ride","Fueled By Ramen",19,120,188,"21362"
145,"spotify:track:58zsLZPvfflaiIbNWoA22O","Rag'n'Bone Man","Human","Best Laid Plans/Columbia",5,146,201,"21065"
146,"spotify:track:1iDQ2zCOU1uYeR8QcpqUZb","Booba","DKR - Bonus Track","Universal Music Distribution Deal",14,159,197,"21015"
147,"spotify:track:6mICuAdrwEjh6Y6lroV2Kg","Shakira, Maluma","Chantaje (feat. Maluma)","Sony Music Latin",13,165,200,"20961"
148,"spotify:track:5B13mNIiknPY2zKCyn1O6L","S.Pri Noir","Skywalker","Believe Recordings",124,143,94,"20917"
149,"spotify:track:6i50VdSdYcpnkuwTV2XhfW","Niro","Avant de partir","Universal Music Division Capitol Music France",106,174,13,"20874"
150,"spotify:track:33N0DD1cmllJxjKQvJkFo2","Dosseh","PDCV (Pas dans cette vie)","Universal Music Division Capitol Music France",141,149,6,"20845"
151,"spotify:track:26haJjtanhamtf25RXH0MO","Martin Solveig, ALMA","All Stars","EMI",138,156,14,"20829"
152,"spotify:track:7hDc8b7IXETo14hHIHdnhd","Drake","Passionfruit","Cash Money Records/Young Money Ent./Universal Rec.",2,153,124,"20743"
153,"spotify:track:17Fd6Yb7mSbinKG8LoWfFl","Mike Posner, Seeb","I Took A Pill In Ibiza - Seeb Remix","Monster Mountain, LLC / Island",18,164,198,"20735"
154,"spotify:track:0fBxgiQe76HZFFqN2FUUpw","Damso","Η. Gova","Universal Music Division Carthage Music",9,148,84,"20721"
155,"spotify:track:6ymKsfbFtQ12mmPJxPAamb","SCH","Poupée russe","Universal Music Division Capitol Music France",14,144,91,"20691"
156,"spotify:track:1kgws2l8gsvDhtsVyzWbu9","Parcels","Overnight","Because Music",103,158,24,"20601"
157,"spotify:track:1yxgsra98r3qAtxqiGZPiX","Travis Scott","BUTTERFLY EFFECT","Cactus Jack / Epic",157,160,3,"20487"
158,"spotify:track:3fHXUNVKNZQ4WaUGLwWxHP","Damso, Booba","Paris c'est loin","Universal Music Division Carthage Music",67,154,201,"20415"
159,"spotify:track:6QUDs5wTqWwI4Ed68GLdlC","Ninho","Roro","Rec. 118 / Mal Luné Music",67,150,89,"20353"
160,"spotify:track:0nhKXS1KL8ffn40Un1q91D","Sofiane","Poto","Universal Music Division Capitol Music France",35,173,69,"20345"
161,"spotify:track:1uaAq8pSghvpVxlrOrgdeO","Lomepal","Yeux disent","Pineale Prod - Grand Musique Management",115,155,27,"20318"
162,"spotify:track:2sOrroHqKbYFP2MfHxhQMc","Rim'K","Cellophané","MB",51,157,201,"20287"
163,"spotify:track:3a1lNhkSLSkpJE4MSHpDu9","Post Malone, Quavo","Congratulations","Mercury Records/Republic Owned",145,171,40,"20074"
164,"spotify:track:1ssmjAYSU5PbmsjLq5yrNH","Sia","Never Give Up (From ""Lion"" Soundtrack)","Masterworks",22,129,132,"20062"
165,"spotify:track:4J6xvZhJh26lmAEAXGDCKu","Naive New Beaters, Izïa","Heal Tomorrow","Universal Music Division Capitol Music France",28,145,185,"20012"
166,"spotify:track:2lFWyfuXtCN8Sb7cHJILva","PNL","J'suis QLF","QLF Records",93,168,117,"19999"
167,"spotify:track:5nQHYFZC2mcUF1ouFBPsz1","Scridge","Pour walou","Snafu Records",121,162,86,"19924"
168,"spotify:track:0L7loeTIg6akW84aEQZpCT","Major Lazer, Nyla, Fuse ODG","Light It Up","Third Pardee Records",45,152,171,"19882"
169,"spotify:track:0KKkJNfGyhkQ5aFogxQAPU","Bruno Mars","That's What I Like","Atlantic Records",31,169,145,"19852"
170,"spotify:track:3NdDpSvN911VPGivFlV5d0","ZAYN, Taylor Swift","I Don’t Wanna Live Forever (Fifty Shades Darker)","Taylor Swift",2,170,199,"19640"
171,"spotify:track:0tICYNayWWhH9GPeFrfjfD","Kungs, Cookin' On 3 Burners","This Girl (Kungs Vs. Cookin' On 3 Burners)","Universal Music Division Polydor France",80,190,183,"19597"
172,"spotify:track:0dJhKHDhqu1QYWfMy54G3F","Feder, Daecolm","Back for More (feat. Daecolm)","Elektra France",31,131,69,"19438"
173,"spotify:track:1Ylz8QTIwBUbO20z8VJyop","Naza","MMM","Bomaye musik",166,180,6,"19399"
174,"spotify:track:4I2Z1gxRN4f55EmMwhzKxK","Benash, Shay, Damso","Ivre","Universal Music Division Capitol Music France",88,161,74,"19366"
175,"spotify:track:4S1ZmpEshXG3S0OLdodb1W","Sneazzy, Nekfeu","Skurt Cobain","Believe Recordings",86,179,190,"19302"
176,"spotify:track:3AbR9rS5iPPPG5F5TJtLMs","Sadek, Brulux","La Bise (feat. Brulux)","Rec. 118 / Industreet",59,167,196,"19180"
177,"spotify:track:6iTVIAqZpHmCK9jrpDyDVo","Kungs, Ephemerals","I Feel So Bad","Universal Music Division Polydor France",23,166,189,"19118"
178,"spotify:track:5c0aiERRxHjbvu5tQ9jwAE","Dagny","Wearing Nothing","Universal Records",160,163,15,"18956"
179,"spotify:track:1wxBP4KwMN2UyMJc6S0GJn","Naza","A Gogo","Bomaye musik",166,177,8,"18854"
180,"spotify:track:6D8tdYo3mBOIUrWAk8wOVo","Alonzo, MHD","Feu d'artifice","Universal Music Division Island Def Jam",44,182,126,"18755"
181,"spotify:track:5uCax9HTNlzGybIStD3vDh","James Arthur","Say You Won't Let Go","Columbia",12,-1,164,"18703"
182,"spotify:track:0ban5QRXUveaKtQPGuaoQ9","Kaaris","Tchoin","Universal Music Division Virgin Records",2,187,198,"18668"
183,"spotify:track:6gLkunWShYxvE8p7AGXbw3","Jul","Je suis resté le même","D'Or et de Platine",45,176,21,"18656"
184,"spotify:track:2GP3ncrLU8jeyrnLTi9uZ1","Keen' V","Elle a","Warner (France)",122,175,14,"18642"
185,"spotify:track:5ZtoiFGlZ3tur8NJAMn0ws","Rilès","THANK GOD","Republic Records",53,184,87,"18612"
186,"spotify:track:0u6HzAVFUBiKslzPF9G9vd","Ninho","Dis-moi que tu m'aimes","Rec. 118 / Mal Luné Music",66,183,182,"18492"
187,"spotify:track:6wR97bho2QoIiP5wxNxtQz","Djadja & Dinaz","C'est la même","Carré-Music",25,185,130,"18431"
188,"spotify:track:6dbdxneD4mLKDgXJ6GQkJm","Soprano","Roule","Rec. 118",54,181,146,"18356"
189,"spotify:track:1SJtlNRJDeYHioymcvsqev","Camila Cabello","Crying in the Club","Syco Music/Epic",67,-1,21,"18294"
190,"spotify:track:6tM2eT1MabbdZUFtiEBdjb","Lorenzo","Freestyle du sale","MFC",163,193,11,"18072"
191,"spotify:track:3akaKS6VFRCuMx0Ixfv3MZ","Jul","Monde violent","D'Or et de Platine",63,178,21,"18023"
192,"spotify:track:7dn6WQzScfRGpp7XdTiCj0","PNL","Le monde ou rien","QLF Records",103,198,126,"18001"
193,"spotify:track:11hj8c8BCRd5ND3CRhZSvt","Nekfeu","Squa","Universal Music Division Carthage Music",2,199,186,"17793"
194,"spotify:track:65mBlk8cyhVpe1OUhLShhp","Naps","Vroum vroum","Duetti",126,188,57,"17762"
195,"spotify:track:3nnxxoByJdFYR0TYHghqli","Ashh","Lolita","Universal Music Division Virgin Records Distribution Deal",195,197,3,"17573"
196,"spotify:track:2qQ9rKLbylbmmmR9RUSdWI","Hornet La Frappe","Double H","MyMedia Agency",100,192,103,"17563"
197,"spotify:track:3zLMWD22TUiKZ3L6FPjiCL","Sadek, Gradur","Andale (feat. Gradur)","Rec. 118 / Industreet",70,-1,161,"17557"
198,"spotify:track:1MgULrPuG7Jnrtonwx3nYT","Niro","Oxymore","Universal Music Division Capitol Music France",106,-1,9,"17542"
199,"spotify:track:1louJpMmzEicAn7lzDalPW","Cheat Codes, Demi Lovato","No Promises (feat. Demi Lovato)","Parlophone UK",131,186,28,"17418"
200,"spotify:track:2ixB59eXNIH8qyEMP15IOj","DJ Hamida, Lartiste","C'est une frappe","Meknessi Style Records",190,-1,4,"17244"
